Prospectus ID,Original Filename,Section ID,Section Title,Subsection ID,Subsection Title,Subsubsection ID,Subsubsection Title,Subsubsection Text,Parsing Error,From Folder,Prospectus Year,PDF Page Count
267,Offerings 2020.md,3132,§ 3 (ZINSEN),3132.36,[Im Fall einer Marge ist folgendes,3132.36.17,"Verordnung) erfüllt, dann soll der Zinssatz","für die betreffende Zinsperiode und alle folgenden Zinsperioden auf Basis dieses offiziell bekanntgegebenen Ersatz-Referenzsatzes bestimmt werden, den die Emittentin der Emissionsstelle, der Berechnungsstelle mindestens 5 Tage vor dem relevanten Zinsfestlegungstag und gemäß § 12 dieser Emissionsbedingungen den Gläubigern mitteilt. Ein Ersatz-Referenzsatz gilt insbesondere dann als offiziell bekanntgegeben, wenn er vom Administrator des Referenzsatzes, von der zuständigen Zentralbank oder einer maßgeblichen Kontroll- oder Aufsichtsbehörde oder einer Gruppe von diesen oder von einer Arbeitsgruppe oder einem Ausschuss, die von einem oder mehreren von ihnen oder dem Financial Stability Board gefördert oder geleitet wird oder auf dessen bzw. deren Verlangen gebildet wird, als NachfolgeReferenzsatz für den Referenzsatz empfohlen wird. (ii) Wird der Referenzsatz nicht durch einen offiziell bekanntgegebenen ErsatzReferenzsatz, der die Anforderungen der Benchmark-Verordnung erfüllt, ersetzt, kann die Emittentin nach ihrem Ermessen beschließen, einen geeigneten ErsatzReferenzsatz zu bestimmen, der nach Ansicht der Emittentin nach Konsultation mit einem von ihr bestellten unabhängigen Sachverständigen dem Referenzsatz in seiner Zusammensetzung möglichst nahekommt und die Anforderungen der Benchmark-Verordnung erfüllt; in diesem Fall soll der Zinssatz für die betreffende Zinsperiode und alle folgenden Zinsperioden auf Basis dieses von der Emittentin bestimmten Ersatz-Referenzsatzes bestimmt werden und die Emittentin wird eine solche Ersetzung der Emissionsstelle, der Berechnungsstelle mindestens 5 Tage vor dem relevanten Zinsfestlegungstag und gemäß § 12 dieser Emissionsbedingungen den Gläubigern mitteilen. (iii) Ein gemäß Unterabsatz (i) oder (ii) dieses § 3(2)(b) bestimmter ErsatzReferenzsatz erfüllt die Anforderungen der Benchmark-Verordnung, wenn: ----- Regulation if: (A) in accordance with Article 29(1) of the Benchmark Regulation, the substitute reference rate, (I) will be provided by an administrator located in the European Union and will be included in the register as referred to in Article 36 of the Benchmark Regulation or (II) will be provided by an administrator located in a third country for use in the European Union; and (B) the substitute reference rate as well as the administrator will be included in the register as referred to in Article 36 of the Benchmark Regulation.",N/A,as_expected,2020,234
267,Offerings 2020.md,3132,§ 3 (ZINSEN),3132.36,[Im Fall einer Marge ist folgendes,3132.36.18,,"anwendbar:_** Die **_Marge_** beträgt [entsprechende Marge einfügen]%** _per _annum.]_ Bildschirmseite_** bedeutet Reuters Bildschirmseite EURIBOR01 oder die jeweilige Nachfolgeseite, die vom selben System angezeigt wird oder aber von einem anderen System, das zum Vertreiber von Informationen zum Zwecke der Anzeigen von Sätzen oder Preisen ernannt wurde, die mit dem betreffenden Angebotssatz vergleichbar sind. Sollte die Bildschirmseite nicht zur Verfügung stehen oder wird zu der genannten Zeit kein Angebotssatz angezeigt und beruht dies jeweils auf anderen Gründen als dem Eintritt eines BenchmarkEreignisses (wie nachstehend definiert), wird die Berechnungsstelle von den Referenzbanken (wie nachstehend definiert) deren jeweilige Angebotssätze (jeweils als Prozentsatz _per annum ausgedrückt) für Einlagen in der festgelegten Währung für die betreffende Zinsperiode und über einen repräsentativen Betrag gegenüber führenden Banken im Interbanken-Markt in der EuroZone um ca. 11.00 (Brüsseler Ortszeit) am Zinsfestlegungstag anfordern. Falls zwei oder mehr Referenzbanken der Berechnungsstelle solche Angebotssätze nennen, ist der Zinssatz für die betreffende Zinsperiode das arithmetische Mittel (falls erforderlich, auf- oder abgerundet auf das nächste ein Tausendstel Prozent, wobei 0,0005 aufgerundet wird) dieser Angebotssätze **[im Fall einer Marge ist folgendes_** **_anwendbar:_** [zuzüglich] [abzüglich] der Marge], wobei alle Festlegungen durch die Berechnungsstelle erfolgen. Falls an einem Zinsfestlegungstag nur eine oder keine der Referenzbanken der Berechnungsstelle solche im vorstehenden Absatz beschriebenen Angebotssätze nennt, ist der Zinssatz für die betreffende Zinsperiode der Satz _per annum, den die Berechnungsstelle als das arithmetische Mittel (falls erforderlich, auf- oder abgerundet auf das nächste ein Tausendstel Prozent, wobei 0,0005 aufgerundet wird) der Angebotssätze ermittelt, die die Referenzbanken oder zwei oder mehr von diesen der Berechnungsstelle auf ihre ----- Reference Banks or any two or more of them, at which such banks were offered, as at 11.00 a.m. (Brussels time) on the relevant Interest Determination Date, deposits in the Specified Currency for the relevant Interest Period by leading banks in the Euro-Zone interbank market [in case of anwendbar:_** Die **_Marge_** beträgt [entsprechende Marge einfügen]%** _per _annum.]_ Bildschirmseite_** bedeutet Reuters Bildschirmseite LIBOR01 oder die jeweilige Nachfolgeseite, die vom selben System ----- as may be nominated as the information vendor for the purposes of displaying rates or prices comparable to the relevant offered quotation. If the Screen Page is not available or if no such quotation appears at such time, in each case for reasons other than the occurrence of a Benchmark Event (as defined below), the Calculation Agent shall request each of the Reference Banks (as defined below) to provide the Calculation Agent with its offered quotation (expressed as a percentage rate _per annum) for deposits in the Specified Currency for the relevant Interest Period and in a representative amount to prime banks in the London interbank market at approximately 11.00 a.m. (London time) on the Interest Determination Date. If two or more of the Reference Banks provide the Calculation Agent with such offered quotations, the Rate of Interest for such Interest Period shall be the arithmetic mean (rounded if necessary to the nearest one hundred-thousandth of a percentage point, with 0.000005 being rounded upwards) of such offered quotations **[in case of a Margin, the following applies:_** [plus] [minus] the Margin], all as determined by the Calculation Agent. If on any Interest Determination Date only one or none of the Reference Banks provides the Calculation Agent with such offered quotations as provided in the preceding paragraph, the Rate of Interest for the relevant Interest Period shall be the rate _per annum which the Calculation Agent determines as being the arithmetic mean (rounded if necessary to the nearest one hundred-thousandth of a percentage point, with 0.000005 being rounded upwards) of the rates, as communicated to (and at the request of) the Calculation Agent by the Reference Banks or any two or more of them, at which such banks were offered, as at 11.00 a.m. (London time) on the relevant Interest Determination Date, deposits in the Specified Currency for the relevant Interest Period by leading banks in the London interbank market [in case of a",N/A,as_expected,2020,234
267,Offerings 2020.md,3132,§ 3 (ZINSEN),3132.37,[im Fall einer Marge ist folgendes,3132.37.1,anwendbar: [zuzüglich] [abzüglich] der,"Marge]. Für den Fall, dass der Zinssatz nicht gemäß den vorstehenden Bestimmungen dieses Absatzes ermittelt werden kann, ist der Zinssatz der Angebotssatz oder das arithmetische Mittel der Angebotssätze auf der Bildschirmseite, wie vorstehend beschrieben, an dem letzten Tag vor dem Zinsfestlegungstag, an dem ein solcher Angebotssatz angezeigt wurde **[im Fall",N/A,as_expected,2020,234
267,Offerings 2020.md,3132,§ 3 (ZINSEN),3132.37,[im Fall einer Marge ist folgendes,3132.37.2,einer Marge ist folgendes anwendbar:,"[zuzüglich] [abzüglich] der Marge (wobei jedoch, falls für die betreffende Zinsperiode eine andere Marge als für die unmittelbar vorhergehende Zinsperiode gilt, die Marge der betreffenden Zinsperiode an die Stelle der Marge für die vorangegangenen Zinsperiode tritt)]. Referenzbanken_** bezeichnet vier Großbanken im Interbanken-Markt in der Euro-Zone.",N/A,as_expected,2020,234
267,Offerings 2020.md,3132,§ 3 (ZINSEN),3132.37,[im Fall einer Marge ist folgendes,3132.37.3,"repräsentativer Betrag bedeutet ein Betrag,",der zu der jeweiligen Zeit in dem jeweiligen Markt für eine einzelne Transaktion repräsentativ ist.,N/A,as_expected,2020,234
267,Offerings 2020.md,3132,§ 3 (ZINSEN),3132.37,[im Fall einer Marge ist folgendes,3132.37.4,Euro-Zone bezeichnet das Gebiet derjenigen,"Mitgliedstaaten der Europäischen Union, die ----- Union that have adopted, or will have adopted from time to time, the single currency in accordance with the Treaty establishing the European Community (signed in Rome on March 25, 1957), as amended by the Treaty on European Union (signed in Maastricht on February 7, 1992) and the Amsterdam Treaty of October 2, 1997, as further amended from time to time.]",N/A,as_expected,2020,234
267,Offerings 2020.md,3132,§ 3 (ZINSEN),3132.39,centre(s)] Business Day_** **[prior to the,3132.39.1,Business Day means a day (other than a,Saturday or Sunday) on which commercial banks are open for business (including dealings in foreign exchange and foreign currency) in [relevant financial centre(s)].,N/A,as_expected,2020,234
267,Offerings 2020.md,3132,§ 3 (ZINSEN),3132.39,centre(s)] Business Day_** **[prior to the,3132.39.2,,commencement] of the relevant Interest Period. **[relevant** **_financial_** **_centre(s)],N/A,as_expected,2020,234
267,Offerings 2020.md,3132,§ 3 (ZINSEN),3132.40,[In case of a Margin the following applies:_** **_Margin means_** **[insert relevant,3132.40.1,Margin]% per annum.] Screen Page means the Reuters screen,"page LIBOR01 or the relevant successor page on that service or on any other service gemäß dem Vertrag über die Gründung der Europäischen Gemeinschaft (unterzeichnet in Rom am 25. März 1957), geändert durch den Vertrag über die Europäische Union (unterzeichnet in Maastricht am 7. Februar 1992) und den Amsterdamer Vertrag vom 2. Oktober 1997, in seiner jeweiligen Fassung, eine einheitliche Währung eingeführt haben oder jeweils eingeführt haben werden.]",N/A,as_expected,2020,234
267,Offerings 2020.md,3132,§ 3 (ZINSEN),3132.43,[In case the specific fallback provision,3132.43.1,"""Reference_** **_Rate_** **_for_** **_the_** **_preceding Interest Period"" shall apply, the following applies:","(iv) If it is not possible, in the Issuer's opinion, to determine a successor reference rate in accordance with sub-clause (i) or (ii) of this § 3(2)(b), the Rate of Interest for the relevant Interest Period and any future Interest Period shall be determined on the basis of the Reference Rate used for determining the relevant Rate of Interest for the Interest Period immediately preceding the relevant Interest Period and the Issuer shall give notice thereof to the Fiscal Agent, the Calculation Agent and, in accordance with § 12 of these Terms and Conditions, to the Holders.] In case of a substitution in accordance with sub-clause (i) or (ii) above, the Issuer will specify which screen page or other source shall be used for determining the substitute reference rate and if, in the opinion of the Issuer (after consultation with an independent financial adviser appointed by it), it would be impracticable to determine the substitute reference rate on the date specified as Interest Determination Date in these Terms and Conditions, the Issuer will specify a suitable date to replace the Interest Determination Date. In addition, the Issuer (after consultation with an independent financial adviser appointed by it) may specify an interest adjustment factor or fraction which shall be applied in determining the Rate of Interest and calculating the Interest Amount and may also make any further adjustments to the (A) der Ersatz-Referenzwert gemäß Artikel 29 Absatz 1 der BenchmarkVerordnung, (I) von einem Administrator bereitgestellt wird, der in der Europäischen Union angesiedelt ist und in das Register nach Artikel 36 der Benchmark-Verordnung eingetragen ist oder (II) von einem in einem Drittstaat angesiedelten Administrator für die Verwendung in derEuropäischen Union bereitgestellt wird; und (B) der Ersatz-Referenzwert sowie der Administrator in das Register nach Artikel 36 der Benchmark-Verordnung eingetragen sind.",N/A,as_expected,2020,234
267,Offerings 2020.md,3132,§ 3 (ZINSEN),3132.44,"[Für** **_den_** **_Fall,_** **_dass_** **_die_** **_besondere",3132.44.1,"Fallbackregelung_** **_""Referenzsatz_** **_der vorangegangenen Zinsperiode"" anwendbar ist, ist folgendes anwendbar:","(iv) Falls es nach Auffassung der Emittentin nicht möglich ist, einen Ersatz-Referenzsatz gemäß Unterabsatz (i) oder (ii) dieses § 3(2)(b) zu bestimmen, ist der Zinssatz für die maßgebliche Zinsperiode und alle folgenden Zinsperioden auf Basis des Referenzsatzes zu bestimmen, der für die Bestimmung des Zinssatzes für die der Zinsperiode unmittelbar vorangegangene Zinsperiode verwendet worden war und die Emittentin wird dies der Emissionsstelle, der Berechnungsstelle und gemäß § 12 dieser Emissionsbedingungen den Gläubigern mitteilen.] Im Fall einer Ersetzung gemäß vorstehendem Unterabsatz (i) oder (ii), legt die Emittentin fest, welche Bildschirmseite oder andere Quelle zur Ermittlung des ErsatzReferenzsatzes verwendet werden soll und, falls nach Meinung der Emittentin (nach Konsultation mit einem von ihr bestellten unabhängigen Sachverständigen) die Bestimmung des Ersatz-Referenzsatzes an dem in diesen Emissionsbedingungen festgelegten Zinsfestlegungstag impraktikabel wäre, legt die Emittentin einen geeigneten Tag als neuen Zinsfestlegungstag fest. Zusätzlich kann die Emittentin (nach Konsultation mit einem von ihr bestellten unabhängigen Sachverständigen) einen Zinsanpassungsfaktor oder Bruch festlegen, der bei der Ermittlung des Zinssatzes und bei der Berechnung des zu Zinsbetrags ----- Terms and Conditions (including, but not limited to, amendments with respect to the Day Count Fraction, Business Day Convention, Business Days and the method to determine the fallback rate to the substitute reference rate), for the purpose of achieving a result which is consistent with the economic substance of the Notes before the Benchmark Event occurred. The Issuer shall give notice of the above specifications to the Fiscal Agent, the Calculation Agent and, in accordance with § 12 of these Terms and Conditions, to the Holders. Reference_** **_Rate_** means the offered quotation specified in the Final Terms and, following the occurrence of a Benchmark Event, the relevant substitute reference rate determined in accordance with this § 3(2)(b). angewendet werden soll, und kann weitere Anpassungen der Emissionsbedingungen vornehmen (einschließlich, aber nicht beschränkt auf Anpassungen in Bezug auf den Zinstagequotienten, die GeschäftstagKonvention, die Geschäftstage sowie die Methode der Bestimmung eines Fallbacksatzes zum Ersatz-Referenzsatz), mit dem Ziel ein Ergebnis zu erzielen, das mit dem wirtschaftlichen Gehalt der Schuldverschreibung vor Eintritt des Benchmark-Ereignisses vereinbar ist. Die Emittentin wird die vorgenannten Festlegungen der Emissionsstelle, der Berechnungsstelle und gemäß § 12 dieser Emissionsbedingungen den Gläubigern mitteilen. Referenzsatz_** bezeichnet den in den Endgültigen Bedingungen festgelegten Angebotssatz bzw., nach Eintritt eines Benchmark-Ereignisses, den jeweiligen gemäß diesem § 3(2)(b) bestimmten ErsatzReferenzsatz.",N/A,as_expected,2020,234
267,Offerings 2020.md,3132,§ 3 (ZINSEN),3132.44,"[Für** **_den_** **_Fall,_** **_dass_** **_die_** **_besondere",3132.44.2,Benchmark Event means:_** **_Benchmark-Ereignis bezeichnet:,"(i) any permanent and final termination of the determination, provision or publication of the Reference Rate by any administrator in circumstances where no successor administrator exists, or any other permanent and final discontinuation of the existence of the Reference Rate; or (ii) a material change in the methodology of determining or calculating the Reference Rate as compared to the methodology used at the date of the issuance of the Notes or, as applicable, at the date on which the relevant substitute reference rate was determined in accordance with these Terms and Conditions if such change results in the Reference Rate, calculated in accordance with the new methodology, no longer representing, or being apt to represent adequately, the Reference Rate (as defined above) or in terms of economic substance no longer being comparable to the Reference Rate (as defined above) determined or calculated in accordance with the methodology used at the date of the issuance of the Notes or, as applicable, at the date on which the relevant substitute reference rate was determined in accordance with these (i) eine dauerhafte und endgültige Einstellung der Ermittlung, Bereitstellung oder Veröffentlichung des Referenzsatzes durch einen Administrator, ohne dass ein Nachfolge-Administrator existiert, oder ein sonstiger dauerhafter und endgültiger Wegfall des Referenzsatzes; oder (ii) eine wesentliche Änderung der Methodik zur Ermittlung oder Berechnung des Referenzsatzes im Vergleich zu derjenigen, die am Tag der Begebung der Schuldverschreibungen oder gegebenenfalls am Tag der Festlegung des betreffenden ErsatzReferenzsatzes zur Anwendung kam, wenn diese dazu führt, dass der gemäß der neuen Methodik ermittelte und berechnete Referenzsatz nicht mehr den Referenzsatz (wie oben definiert) repräsentiert oder zu repräsentieren geeignet ist oder dass der gemäß der neuen Methodik ermittelte und berechnete Referenzsatz aus sonstigen Gründen seinem wirtschaftlichen Gehalt nach nicht mehr dem Referenzsatz (wie oben definiert) vergleichbar ist, der mit der am Tag der Begebung der Schuldverschreibungen oder ----- Terms and Conditions; or gegebenenfalls am Tag der Festlegung des betreffenden ErsatzReferenzsatzes zur Anwendung kommenden Methodik ermittelt oder berechnet wurde; oder (iii) the applicability of any law or any other legal provision, or of any administrative or judicial order, decree or other binding measure, pursuant to which the Reference Rate may no longer be used as a reference rate to determine the payment obligations under the Notes, or pursuant to which any such use is subject to not only immaterial restrictions or adverse consequences.",N/A,as_expected,2020,234
267,Offerings 2020.md,3132,§ 3 (ZINSEN),3132.45,"[In case of a Minimum Rate of Interest, the",3132.45.1,following applies:,"(iii) die Anwendbarkeit eines Gesetzes oder einer sonstigen Rechtsvorschrift oder einer behördlichen oder gerichtlichen Anordnung, Verfügung oder sonstigen verbindlichen Maßnahme, die unmittelbar dazu führt, dass der Referenzsatz nicht mehr als Referenzwert zur Bestimmung von Zahlungsverpflichtungen unter den Schuldverschreibungen verwendet werden darf oder nach der eine derartige Verwendung nicht nur unwesentlichen Beschränkungen oder nachteiligen Folgen unterliegt.",N/A,as_expected,2020,234
267,Offerings 2020.md,3132,§ 3 (ZINSEN),3132.46,[Im Fall eines Mindestzinssatzes ist folgendes,3132.46.1,anwendbar:,(3) Minimum Rate of Interest. (3) Mindestzinssatz. If the Rate of Interest in respect of any Interest Period determined in accordance with the above provisions is less than **[Minimum Rate of,N/A,as_expected,2020,234
267,Offerings 2020.md,3132,§ 3 (ZINSEN),3132.46,[Im Fall eines Mindestzinssatzes ist folgendes,3132.46.2,"Interest], the Rate of Interest for such Interest",Period shall be [Minimum Rate of Interest].],N/A,as_expected,2020,234
267,Offerings 2020.md,3132,§ 3 (ZINSEN),3132.47,[In case of a Maximum Rate of Interest the,3132.47.1,following applies:,"Wenn der gemäß den obigen Bestimmungen für eine Zinsperiode ermittelte Zinssatz niedriger ist als **[Mindestzinssatz], so ist der Zinssatz für diese Zinsperiode [Mindestzinssatz].]",N/A,as_expected,2020,234
267,Offerings 2020.md,3132,§ 3 (ZINSEN),3132.48,[Im Fall eines Höchstzinssatzes ist folgendes,3132.48.1,anwendbar:,(3) Maximum Rate of Interest. (3) Höchstzinssatz. If the Rate of Interest in respect of any Interest Period determined in accordance with the above provisions is greater than **[Maximum Rate of,N/A,as_expected,2020,234
267,Offerings 2020.md,3132,§ 3 (ZINSEN),3132.48,[Im Fall eines Höchstzinssatzes ist folgendes,3132.48.2,"Interest], the Rate of Interest for such Interest",Period shall be [Maximum Rate of Interest].] Wenn der gemäß den obigen Bestimmungen für eine Zinsperiode ermittelte Zinssatz höher ist als,N/A,as_expected,2020,234
267,Offerings 2020.md,3132,§ 3 (ZINSEN),3132.49,"[Höchstzinssatz], so ist der Zinssatz für diese",3132.49.1,Zinsbetrag) für die entsprechende Zinsperiode,"berechnen. Der Zinsbetrag wird ermittelt, indem der Zinssatz und der Zinstagequotient (wie nachfolgend definiert) auf jede Festgelegte Stückelung angewendet werden, wobei der resultierende Betrag auf die kleinste Einheit der Festgelegten Währung auf- oder abgerundet wird, wobei 0,5 solcher Einheiten aufgerundet werden. [(5)] Notification of Rate of Interest and Interest [(5)] Mitteilung von Zinssatz und Zinsbetrag. ----- Amount. The Calculation Agent will cause the Rate of Interest, each Interest Amount for each Interest Period, each Interest Period and the relevant Interest Payment Date to be notified to the Issuer",N/A,as_expected,2020,234
267,Offerings 2020.md,3132,§ 3 (ZINSEN),3132.49,"[Höchstzinssatz], so ist der Zinssatz für diese",3132.49.2,,"Zinsperiode [Höchstzinssatz].] [(4)] Interest Amount. [(4)] Zinsbetrag. The Calculation Agent will, on or as soon as practicable after each time at which the Rate of Interest is to be determined, determine the Rate of Interest and calculate the amount of interest (the **_Interest Amount) payable on the Notes in respect of each Specified Denomination for the relevant Interest Period. Each Interest Amount shall be calculated by applying the Rate of Interest and the Day Count Fraction (as defined below) to each Specified Denomination and rounding the resultant figure to the nearest unit of the Specified Currency, with 0.5 of such unit being rounded upwards. Die Berechnungsstelle wird zu oder baldmöglichst nach jedem Zeitpunkt, an dem der Zinssatz zu bestimmen ist, den Zinssatz bestimmen und den auf die Schuldverschreibungen zahlbaren Zinsbetrag in Bezug auf jede Festgelegte Stückelung (der",N/A,as_expected,2020,234
267,Offerings 2020.md,3132,§ 3 (ZINSEN),3132.50,[in the case of Notes issued by an issuer other,3132.50.1,"than ZF Friedrichshafen AG, the following applies: and the Guarantor] and to the Holders in","accordance with § 12 as soon as possible after their determination, but in no event later than the fourth [TARGET2] **[relevant** **_financial",N/A,as_expected,2020,234
267,Offerings 2020.md,3132,§ 3 (ZINSEN),3132.50,[in the case of Notes issued by an issuer other,3132.50.2,centre(s)] Business Day (as defined in § 3(2)),"thereafter and if required by the rules of any stock exchange on which the Notes are from time to time listed, to such stock exchange as soon as possible after their determination, but in no event later than the first day of the relevant Interest Period. Each Interest Amount and Interest Payment Date so notified may subsequently be amended (or appropriate alternative arrangements made by way of adjustment) without notice in the event of an extension or shortening of the Interest Period. Any such amendment will be promptly notified to any stock exchange on which the Notes are then listed and to the Holders in accordance with § 12. Die Berechnungsstelle wird veranlassen, dass der Zinssatz, der Zinsbetrag für die jeweilige Zinsperiode, die jeweilige Zinsperiode und der betreffende Zinszahlungstag der Emittentin **[bei",N/A,as_expected,2020,234
267,Offerings 2020.md,3132,§ 3 (ZINSEN),3132.50,[in the case of Notes issued by an issuer other,3132.50.3,"Schuldverschreibungen, die von einer anderen Emittentin als der ZF Friedrichshafen AG begeben werden, ist folgendes anwendbar: und","der Garantin] sowie den Gläubigern gemäß § 12 baldmöglichst, aber keinesfalls später als am vierten auf die Berechnung jeweils folgenden [TARGET2] **[relevante(s) Finanzzentrum(en)] Geschäftstag (wie in § 3(2) definiert) sowie jeder Börse, an der die betreffenden Schuldverschreibungen zu diesem Zeitpunkt notiert sind und deren Regeln eine Mitteilung an die Börse verlangen, baldmöglichst nach der Bestimmung, aber keinesfalls später als am ersten Tag der jeweiligen Zinsperiode mitgeteilt werden. Im Fall einer Verlängerung oder Verkürzung der Zinsperiode können der mitgeteilte Zinsbetrag und Zinszahlungstag ohne Vorankündigung nachträglich geändert (oder andere geeignete Anpassungsregelungen getroffen) werden. Jede solche Änderung wird umgehend allen Börsen, an denen die Schuldverschreibungen zu diesem Zeitpunkt notiert sind, sowie den Gläubigern gemäß § 12 mitgeteilt. [(6)] Determinations Binding. [(6)] Verbindlichkeit der Festsetzungen. All certificates, communications, opinions, determinations, calculations, quotations and decisions given, expressed, made or obtained for the purposes of the provisions of this § 3 by the Calculation Agent shall (in the absence of manifest error) be binding on the Issuer, [in the",N/A,as_expected,2020,234
