Prospectus ID,Original Filename,Section ID,Section Title,Subsection ID,Subsection Title,Subsubsection ID,Subsubsection Title,Subsubsection Text,Parsing Error,From Folder,Prospectus Year,PDF Page Count
267,Offerings 2020.md,13,RISK FACTORS,13.50,Rating,13.50.1,,"S&P has assigned a solicited long-term credit rating of ""BB+""[1] (outlook: negative) to ZF AG. Moody's has assigned a solicited long-term credit rating of ""Ba1""[2] (outlook:negative) to ZF AG. S&P and Moody's are established in the European Union and registered under Regulation (EC) No 1060/2009 of the European Parliament and of the Council of September 16, 2009 on credit rating agencies, as amended (the CRA Regulation). In April 2020, S&P lowered its long-term ratings to ZF AG to ""BB+"" and assigned a negative outlook. This downgrade happened due to the Coronavirus pandemic and its caused forecasted decline in global auto demand resulting in intense pressure on auto suppliers in 2020. The outlook remained negative, since the duration and the definite impact of the Coronavirus pandemic on the global auto supplier industry remains uncertain. At the same time, Moody's lowered ZF's long-term corporate credit rating to ""Ba1"" with review for further downgrade. On June 16, 2020, Moody's has confirmed the Ba1 rating (outlook: negative). A credit rating assesses the creditworthiness of an entity and informs an investor therefore about the probability of the entity being able to redeem invested capital. It is not a recommendation to buy, sell or hold Notes and may be subject to suspension, reduction or withdrawal at any time by the assigning rating agency. 1 According to the definition published by S&P Global Ratings Europe Limited on its homepage BB means “Obligations rated 'BB', 'B', 'CCC', 'CC', and 'C' are regarded as having significant speculative characteristics. 'BB' indicates the least degree of speculation and 'C' the highest. While such obligations will likely have some quality and protective characteristics, these may be outweighed by large uncertainties or major exposure to adverse conditions. The ratings from 'AA' to 'CCC' may be modified by the addition of a plus (+) or minus (-) sign to show relative standing within the major rating categories.” 2 According to the definition published by Moody’s Investors Service, Inc., Moody’s Analytics, Inc. and/or their affiliates and licensors on its homepage: “Obligations rated Ba are judged to be speculative and are subject to substantial credit risk. Moody’s appends numerical modifiers 1, 2, and 3 to each generic rating classification from Aa through Caa. The modifier 1 indicates that the obligation ranks in the higher end of its generic rating category.” ----- ZF Finance GmbH has not been assigned any credit rating with its cooperation or at its request. -----",N/A,as_expected,2020,234
267,Offerings 2020.md,13,RISK FACTORS,13.51,ZF FINANCE GMBH General Information,13.51.1,,"The legal and commercial name of the company is ZF Finance GmbH. ZF Finance GmbH was incorporated as a private limited liability company (Gesellschaft mit _beschränkter Haftung) under the laws of the Federal Republic of Germany on July 14, 2020 and is_ governed by the laws of the Federal Republic of Germany. ZF Finance GmbH has its registered office and business office at Löwentaler Straße 20, 88046 Friedrichshafen, Germany. Its phone number is +49 7541 77-0. The duration of ZF Finance GmbH is indefinite. ZF Finance GmbH conducts its business under its legal name. ZF Finance GmbH is registered with the commercial register (Handelsregister) of the local court (Amtsgericht) of Ulm, Germany, under registration number HRB 740352. The Legal Entity Identifier (LEI) of ZF Finance GmbH is 5493001N9T6QDCCXB426.",N/A,as_expected,2020,234
267,Offerings 2020.md,13,RISK FACTORS,13.52,Principal Activities,13.52.1,,"The principal activity of ZF Finance GmbH is to act as finance company within the ZF Group, including the provision of loans to ZF AG and to companies of the ZF Group financed with funds acquired from the capital markets.",N/A,as_expected,2020,234
267,Offerings 2020.md,13,RISK FACTORS,13.53,Organizational Structure and Major Shareholder,13.53.1,,"ZF Finance GmbH is a wholly owned subsidiary of ZF AG and belongs to the ZF Group. For more information on the organizational structure of ZF Group, see ""General Information on the Issuers and _the Guarantor—ZF Friedrichshafen AG—Organizational structure""._ ZF Finance GmbH does not have any subsidiaries of its own and is dependent upon administrative and management services provided by ZF AG and certain subsidiaries of ZF AG.",N/A,as_expected,2020,234
267,Offerings 2020.md,13,RISK FACTORS,13.56,Historical Financial Information and Auditors,13.56.1,,"ZF Finance GmbH has not issued any financial statements since its incorporation. However, ZF Finance GmbH has prepared an opening balance sheet as of July 14, 2020 in accordance with the provisions of German commercial law applicable to cooperations (German Commercial Code (Handelsgesetzbuch, HGB)). Ernst & Young GmbH Wirtschaftsprüfungsgesellschaft, Stuttgart, Germany (EY), a member of the German Chamber of Public Accountants (Wirtschaftsprüferkammer), Berlin, Germany, as independent auditor, has audited the opening balance sheet of ZF Finance GmbH as of July 14, 2020, including the associated disclosure, and issued an unqualified independent auditor's report (Prüfungsvermerk des Wirtschaftsprüfers) thereon. EY conducted its audit of the German language version of this opening balance sheet, including the associated disclosure, in accordance with the German generally accepted standards for financial statement audits promulgated by the Institute of Public Auditors in Germany (Institut der Wirtschaftsprüfer in Deutschland e.V., IDW). ----- The English language translations of the German language audited opening balance sheet of ZF Finance GmbH as of July 14, 2020 and the independent auditor's report (Prüfungsvermerk des _Wirtschaftsprüfers) thereon are incorporated by reference into this Prospectus._",N/A,as_expected,2020,234
267,Offerings 2020.md,13,RISK FACTORS,13.58,"Audited Opening balance sheet of ZF Finance GmbH** **as of July 14, 2020 July 14, 2020 (in EUR) Current Assets Receivables and other assets",13.58.1,,"Receivables from affiliates 100,000.00",N/A,as_expected,2020,234
267,Offerings 2020.md,13,RISK FACTORS,13.59,"Total Assets** **100,000.00 Equity and liabilities Equity",13.59.1,,"Subscribed capital** 100,000.00",N/A,as_expected,2020,234
267,Offerings 2020.md,13,RISK FACTORS,13.60,"Total Equity and liabilities** **100,000.00 Trend Information and Significant Changes",13.60.1,,There has been no material adverse change in the prospects of ZF Finance GmbH since its incorporation. There has been no significant change in the financial performance of ZF Finance GmbH since its incorporation. There has been no significant change in the financial position of ZF Finance GmbH since its incorporation.,N/A,as_expected,2020,234
267,Offerings 2020.md,13,RISK FACTORS,13.61,Recent Events,13.61.1,,There have been no relevant recent events particular to ZF Finance GmbH which are to a material extent relevant to the evaluation of the Issuer's solvency.,N/A,as_expected,2020,234
267,Offerings 2020.md,13,RISK FACTORS,13.65,,13.65.1,,"_Before deciding to purchase any Notes, investors should carefully review and consider the following risk factors and the other information contained in this Prospectus (including any document incorporated by reference) or any supplement to this Prospectus. Should one or more of the risks described below materialize, this may have a material adverse effect on the business, financial condition and results of operations of ZF AG, ZF Finance GmbH and the ZF Group. Moreover, if any of these risks materialize, the market value of the Notes and the ability of ZF AG and/or ZF Finance GmbH to fulfill their respective payment obligations under the Notes and the Guarantee may be affected, in which case holders of Notes issued under the Programme (the Holders and each a Holder) could lose all or part of their investments. Additional risks and uncertainties, which are not currently known to ZF AG and ZF Finance GmbH, or which ZF AG and ZF Finance GmbH currently not consider material, could impair the business operations of ZF AG, ZF Finance GmbH or the ZF Group and have a material adverse effect on their businesses, financial condition and results of operations. The risks to which the business of ZF AG, ZF Finance GmbH or the Group is exposed may result in inaccuracies in risk assessments or other forward-looking statements. An investment in the Notes is only suitable for investors experienced in financial matters who are in a position to fully assess the risks relating to such an investment and who have sufficient financial means to absorb any potential loss stemming therefrom._",N/A,as_expected,2020,234
267,Offerings 2020.md,3122,BUSINESS OF THE ZF GROUP BUSINESS OVERVIEW,3122.1,,3122.1.1,,"Founded in 1915 to produce gears and transmissions for aircraft, motor vehicles, and motorboats, we are today a global leader in the design, manufacturing and sale of driveline and chassis technology as well as active and passive safety technology for the automotive industry and certain industrial sectors. We have production companies in approximately 27 countries, maintain 16 major development locations in Europe, North America, and Asia, and are headquartered in Friedrichshafen, Germany. We are primarily active in the automotive industry, in particular in the areas of transmission systems, active and passive safety systems, units and components, as well as chassis systems and components for passenger car and commercial vehicle manufacturers. However, our activities also cover other market segments such as construction and agricultural machinery, wind power, marine propulsion, aviation technology, rail drives, special drives and test systems. In 2019, by far the largest part of our sales were in the business sector Cars and light commercial vehicles below six tons, followed by sales in the business sector Commercial vehicles over six tons and the business sector Construction and agricultural machinery, marine craft, aircraft and wind power. Our strong presence in the world's largest automotive markets is complemented by a significant footprint in key emerging markets as we are continually expanding our global market presence. In recent years, particularly our operations outside of Western Europe have become increasingly important with not only the established markets in North and South America, Germany and Western Europe and Japan, but also the new markets in the Asia-Pacific region (especially China and India) and Eastern Europe playing a major role. We are expanding our global presence by adapting our products to specific customers and market requirements while considering the most cost effective country for production and procurement. We support the international expansion of our existing customers while also servicing new customers in the markets which we enter. In 2019, we already generated 54% (2018: 53%) of our sales outside our traditional markets in Europe (Germany, Western and Eastern Europe), in particular in North America (29%; 2018: 28%) and South America (3%; 2018: 3%) as well as the AsiaPacific region (21%; 2018: 21%), with China as the core market and India as the growth market. In addition to our primary product offering, we offer a wide range of services that are mainly marketed by our Aftermarket organization. Our international service network of around 130 service locations and approximately 650 service partners offers our customers an extensive range of services globally. These services primarily involve the spare-parts business for driveline and chassis technology as well as maintenance and repair services.",N/A,as_expected,2020,234
267,Offerings 2020.md,158,STRATEGY,158.1,,158.1.1,,"With our strategy ""Next Generation Mobility"" we strive to deliver a clean and safe mobility that is automated, comfortable and affordable. The ""Next Generation Mobility"" strategy builds upon the improvement of the following five core strategic targets: ""Innovation and Cost Leadership"", ""Balanced Market Penetration"", ""Financial Independence"", ""Globally Attractive Employer"" and ""Diversified Product Portfolio"". Due to megatrends such as e-mobility, autonomous driving, new mobility concepts, digitalization, urbanization, globalization, demographic change and the war for talents as well as scarce resources/energy efficiency and global warming, the automotive industry is currently experiencing a rapid change. Focusing on these megatrends with ""Next Generation Mobility"", we intend to tackle the massive on-going transformation with our broad portfolio serving the demands of the customers in the different markets. With our broad product portfolio, covering automated driving, e-mobility, integrated safety systems and vehicle motion control solutions, we are a global system supplier of mobility products and services for passenger cars, commercial vehicles as well as mobility-as-a-service solutions and industrial technology applications. In addition, we have set up our Internet of Things (IoT) cloud-based system in order to enable extensive networking between systems. We plan to be active globally and across all applications in these fields, namely for passenger cars, commercial vehicles, off-highway vehicles and industrial technology. ----- Regarding global markets, we seek to expand our presence in China to enable further development and the manufacturing of our complete product portfolio to support the local market in full. We already offer customers in China high-tech solutions for e-mobility and autonomous driving and we seek to continuously increase our existing customer base with Chinese manufacturers and new mobility providers. In order to further increase our footprint in China, we invest significantly in the expansion of our production capacities and on-site development in China. To highlight the importance of the Chinese market to ZF, our board member Dr. Holger Klein, with responsibility for the Asia-Pacific region, has been directing our business in this increasingly important region directly from ZF's China headquarters in Shanghai. In addition, in 2019 we opened a joint transmission in Jiaxing (China) together with Foton, a Chinese commercial vehicle manufacturer, to produce automatic commercial vehicle transmissions for the Chinese market. In 2015, as part of our ""Strategy 2025"", the Group acquired TRW and was able to integrate it into the corporate structure within a timeframe of about two years. During that time, we were also able to steadily reduce the debts incurred in connection with this acquisition and significantly increase investments in property, plant and equipment, as well as expenditure in research and development. Since then, we have made further acquisitions and entered into strategic partnerships, in particular in the field of mobility-as-a-service and automated guided vehicle growth markets. In 2019, the acquisition of WABCO constituted a further milestone in our corporate history (see ""General _Information on the Issuers and the Guarantor–ZF Friedrichshafen AG–General Information–History and Development"")._ In order to ensure that our organization and structure continues to meet all the requirements from the different markets and customers in the future, in 2018 we decided to adjust our organizational set-up in line with our strategy. One transformation was the introduction of a dual operating system that allows ZF Group to operate at different speeds and organizational modes. The goal is to achieve a maximum of standardized internal processes while remaining very flexible when it comes to serving customers and markets. Additionally, this change aimed at empowering the divisions to better steer their business by giving them a lean and efficient structure.",N/A,as_expected,2020,234
267,Offerings 2020.md,3123,ZF DIVISIONS,3123.1,Active Safety Systems,3123.1.1,,"The Active Safety Systems division includes our braking and steering business and has its headquarters in Livonia, Michigan (United States). Products include Electronic Stability Control, Integrated Brake Control, Electric Park Brakes, Electrically Powered Steering Systems and Electrically Powered Hydraulic Steering Systems. The Active Safety Systems division comprises the business units Foundation Brakes, Brake Controls, Rack Drive and Column Drive. In 2019, the Active Safety Systems division generated sales of EUR 6,303 million (2018: EUR 6,559 million). In the six-month period ended June 30, 2020, the Active Safety Systems division generated sales of EUR 2,014 million (six-month period ended June 30, 2019: EUR 3,207 million).",N/A,as_expected,2020,234
267,Offerings 2020.md,3123,ZF DIVISIONS,3123.2,Car Chassis Technology,3123.2.1,,"The Car Chassis Technology division has the overall responsibility for passenger car chassis products applicable for vehicles up to 6 tons. The product portfolio includes complete front and rear axles, chassis and steering components, dampers, electronic damper and chassis systems for vehicles from all renowned global manufacturers. The Car Chassis Technology division comprises the business units Chassis Systems, Chassis Components and Suspension Technology. ----- In 2019, the Car Chassis Technology division generated sales of EUR 7,684 million (2018: EUR 7,876 million). In the six-month period ended June 30, 2020, the Car Chassis Technology division generated sales of EUR 2,914 million (six-month period ended June 30, 2019: EUR 3,788 million).",N/A,as_expected,2020,234
267,Offerings 2020.md,3123,ZF DIVISIONS,3123.3,Car Powertrain Technology,3123.3.1,,"The Car Powertrain Technology division pools our activities for passenger car driveline technology, in particular the development, production, and sale of transmissions and powertrain modules. The Car Powertrain Technology division comprises the following business units: Automatic Transmissions, Manual Transmissions/ Dual Clutch Transmissions and Powertrain Modules. In 2019, the Car Powertrain Technology division generated sales of EUR 7,312 million (2018: EUR 7,775 million). In the six-month period ended June 30, 2020, the Car Powertrain Technology division generated sales of EUR 2,631 million (six-month period ended June 30, 2019: EUR 3,697 million).",N/A,as_expected,2020,234
267,Offerings 2020.md,3123,ZF DIVISIONS,3123.4,Electronics and ADAS,3123.4.1,,"The Electronics & ADAS division is responsible for advanced driver assist systems (ADAS), sensor technologies, integrated electronics including advanced safety domain control units and safety electronics such as airbag electronic control units and crash sensors for the automotive industry. Electronics and ADAS has its headquarters in Farmington Hills, Michigan (United States). The Electronics & ADAS division comprises the business units Advanced Driver Assistance Systems (ADAS) and Safety Electronics. In 2019, the Electronics and ADAS division generated sales of EUR 1,848 million (2018: EUR 1,666 million). In the six-month period ended June 30, 2020, the Electronics and ADAS division generated sales of EUR 629 million (six-month period ended June 30, 2019: EUR 912 million).",N/A,as_expected,2020,234
267,Offerings 2020.md,3123,ZF DIVISIONS,3123.5,E-Mobility,3123.5.1,,"The E-Mobility division was founded in 2016 and develops and produces hybrid modules, plug-in hybrid transmissions as well as electric drives for vehicles complete with power electronics and system integration. The E-Mobility division comprises the business units Electronic Systems, Electronic Traction Drive, Axle Drives, Electronic Interfaces as well as the System House where all electromobility-related customer requests are processed and the competencies of the Group are bundled. In 2019, the E-Mobility division generated sales of EUR 2,346 million (2018: EUR 2,195 million). In the six-month period ended June 30, 2020, the E-Mobility division generated sales of EUR 851 million (six-month period ended June 30, 2019: EUR 1,131 million).",N/A,as_expected,2020,234
267,Offerings 2020.md,3123,ZF DIVISIONS,3123.6,Passive Safety Systems,3123.6.1,,"The Passive Safety Systems division is responsible for the development and production of occupant safety systems for the automotive industry. Products include airbags, airbag inflators, seat belt systems and steering wheels. The division includes our former Occupant Safety Systems business and has its headquarters in Alfdorf, Germany. The Passive Safety Systems division comprises the business units Inflatable Restraint Systems, Seat Belt Systems and Steering Wheel Systems. In 2019, the Passive Safety Systems division generated sales of EUR 4,337 million (2018: EUR 4,125 million). In the six-month period ended June 30, 2020, the Passive Safety Systems division generated sales of EUR 1,500 million (six-month period ended June 30, 2019: EUR 2,181 million). -----",N/A,as_expected,2020,234
267,Offerings 2020.md,3123,ZF DIVISIONS,3123.7,Commercial Vehicle Control Systems,3123.7.1,,"The Commercial Vehicle Control Systems division, formerly known as WABCO Holdings Inc., was established on May 29, 2020, following the closing of the WABCO acquisition. The Commercial Vehicle Control Systems division comprises the business units Vehicle Dynamics & Control & Autonomous Driving, Driveline & Suspension Controls – Wheel End Solutions, Vehicle Energy Management Systems, Fleet Solutions, Trailer Systems, Off-highway Solutions and Car Systems. In the one-month period since its establishment and ended June 30, 2020, the Commercial Vehicle Control Systems division generated sales of EUR 188 million.",N/A,as_expected,2020,234
267,Offerings 2020.md,3123,ZF DIVISIONS,3123.8,Commercial Vehicle Technology,3123.8.1,,"The Commercial Vehicle Technology division is responsible for our international business of powertrain and chassis technology for commercial vehicles, including automated and manual transmissions, powerline transmissions, and powertrain components, shock absorbers, cabin dampers, axle systems and ADAS technology such as automated, camera and radar-based safety and comfort functions for trucks and buses. The Commercial Vehicle Technology division comprises the following business units: Truck & Van Driveline Technology, Axle & Transmission Systems for Buses & Coaches, CV Chassis Technology, CV Powertrain Modules and CV Steering Systems. In 2019, the Commercial Vehicle Technology division generated sales of EUR 3,701 million (2018: EUR 3,720 million). In the six-month period ended June 30, 2020, the Commercial Vehicle Control Systems division generated sales of EUR 1,505 million (six-month period ended June 30, 2019: EUR 1,950 million).",N/A,as_expected,2020,234
267,Offerings 2020.md,3123,ZF DIVISIONS,3123.9,Industrial Technology,3123.9.1,,"The Industrial Technology division bundles our activities for ""Off-Road"" applications. It focuses on the development and production of transmissions and axles for agricultural and construction machinery as well as driveline technology for material handling systems, rail and special vehicles as well as marine transmissions, aviation technology, wind turbine transmissions and test systems. The Industrial Technology division comprises the following business units: Off-Highway Systems, Industrial Drives, Marine & Special Driveline Technology, Test Systems, Aviation Technology and Wind Power Technology. In 2019, the Industrial Technology division generated sales of EUR 2,990 million (2018: EUR 2,782 million). In the six-month period ended June 30, 2020, the Industrial Technology division generated sales of EUR 1,287 million (six-month period ended June 30, 2019: EUR 1,507 million).",N/A,as_expected,2020,234
267,Offerings 2020.md,3123,ZF DIVISIONS,3123.10,Aftermarket,3123.10.1,,"The division Aftermarket combines our aftersales business as well as the global offering of the ZF Group in retail, services and customer service. The term ""aftermarket"" refers to the market of spare parts that are used in the maintenance and repair of passenger cars and commercial vehicles. The division supports the performance and efficiency of vehicles throughout their life cycle with integrated solutions and the entire ZF product portfolio. In the aftermarket sector, we generally distribute the same products which we also supply to our OEM clients. Since 2017, the division combines the former ZF Services and TRW Aftermarket business units. The TRW name has been retained as a product brand and enhances the existing brand portfolio alongside ZF, Sachs, Lemförder, Boge and Openmatics. ----- The Aftermarket division comprises the following business units: Independent Aftermarket, Original Equipment Service/Specific Original Equipment, Manufacturing and Friction Materials Group. In 2019, the Aftermarket division generated sales of EUR 2,929 million (2018: EUR 2,975 million). In the six-month period ended June 30, 2020, the Aftermarket division generated sales of EUR 1,149 million (six-month period ended June 30, 2019: EUR 1,481 million).",N/A,as_expected,2020,234
267,Offerings 2020.md,3123,ZF DIVISIONS,3123.11,,3123.11.1,,Our operating activities are organized into the following divisions:,N/A,as_expected,2020,234
