Prospectus ID,Original Filename,Section ID,Section Title,Subsection ID,Subsection Title,Subsubsection ID,Subsubsection Title,Subsubsection Text,Parsing Error,From Folder,Prospectus Year,PDF Page Count
1614_1,Offerings 2020.md,13,RISK FACTORS,13.2,Risks Relating to the Notes and Our Indebtedness,13.2.9,"Fraudulent conveyance laws may permit courts to void the Subsidiary_** **_Guarantors’ guarantees of the Notes in specific circumstances, which would interfere with any payment under the Subsidiary_** **_Guarantors’ guarantees.","Federal and state statutes may allow courts, under specific circumstances described below, to void the Subsidiary Guarantors’ guarantees of the Notes. If such a voidance occurs, holders of the Notes might be required to return payments received from our Subsidiary Guarantors in the event of bankruptcy or other financial difficulty of our Subsidiary Guarantors. Under U.S. federal bankruptcy law and comparable provisions of state fraudulent conveyance laws, a guarantee could be set aside if, among other things, a guarantor, at the time it incurred the debt evidenced by its guarantee: - incurred the guarantee with the intent of hindering, delaying or defrauding current or future creditors; or - received less than reasonably equivalent value or fair consideration for incurring the guarantee and (i) was insolvent or was rendered insolvent by reason of the incurrence; (ii) was engaged, or about to engage, in a business or transaction for which the assets remaining with it constituted unreasonably small capital to carry on such business; or (iii) intended to incur, or believed that it would incur, debts beyond its ability to pay as those debts mature. The tests for fraudulent conveyance, including the criteria for insolvency, will vary depending upon the law of the jurisdiction that is being applied. Generally, however, a debtor would be considered insolvent if, at the time the debtor incurred the debt, either: - the sum of the debtor’s debts and liabilities, including contingent liabilities, was greater than the debtor’s assets at fair valuation; ----- - the present fair saleable value of the debtor’s assets was less than the amount required to pay the probable liability on the debtor’s total existing debts and liabilities, including contingent liabilities, as they became absolute and matured; or - it could not pay its debts as they became due. If a court voids guarantees or holds them unenforceable, you will cease to be a creditor of the subsidiary guarantor and will be a creditor solely of us.",N/A,as_expected,2020,73
1614_1,Offerings 2020.md,13,RISK FACTORS,13.2,Risks Relating to the Notes and Our Indebtedness,13.2.10,We may not be able to repurchase the Notes upon a Change of Control Triggering Event.,"If a Change of Control Triggering Event (as defined in the “Description of Notes”) occurs, unless we have exercised our right to redeem the Notes, we will be required to make an offer to repurchase the Notes from holders in cash at a redemption price of 101% of the aggregate principal amount of the Notes repurchased plus accrued and unpaid interest, if any, on the Notes repurchased to, but excluding, the date of repurchase. However, we may not be able to repurchase the Notes upon a Change of Control Triggering Event because we may not have sufficient funds to do so. We may also be required to offer to repurchase certain of our other debt upon a change of control or change of control triggering event, including our Existing Notes, and such event may also give rise to an event of default under the Credit Facilities and the indenture governing our Existing Notes. In addition, agreements governing indebtedness incurred in the future may restrict us from repurchasing the Notes in the event of a Change of Control Triggering Event. Any failure to repurchase properly tendered Notes would constitute an event of default under the indenture, which could, in turn, cause an acceleration of our other indebtedness. See “Description of Notes—Repurchase at the Option of the Holders of Notes.” Certain mergers or consolidations will not constitute a Change of Control Triggering Event and will not require us to make an offer to repurchase the Notes. In addition, we have the ability to reincorporate in certain jurisdictions outside the U.S. without any requirement to pay additional amounts to holders of the Notes in respect of withholding taxes. See “Description of Notes— Merger, Consolidation or Sale of Assets.” -----",N/A,as_expected,2020,73
1614_1,Offerings 2020.md,13,RISK FACTORS,13.3,,13.3.1,,"_Investing in the Notes involves risks. Please see the risk factors set forth below and in our Annual Report Form 10-K for the year ended December 31, 2019, our Quarterly Report on Form 10-Q for the quarter ended June 30, 2020 and documents subsequently filed with the SEC, which are incorporated by reference herein. You should carefully consider each of the following risk factors and all of the other information set forth in this offering memorandum or incorporated by reference herein, including the “Risk Factors” in our Annual Report Form 10-K for the year ended December 31, 2019 and our Quarterly Report on Form 10-Q for the quarter ended June 30, 2020, before investing in the Notes. Based on the information currently known to us, we believe that the risk factors set forth herein and those incorporated by reference in this offering memorandum identify the most significant risk factors affecting our company. However, the risks and uncertainties we face are not limited to those set forth in the risk factors described below or incorporated by reference herein. Additional risks and uncertainties not presently known to us or that we currently believe to be immaterial may also adversely affect our business. In addition, past financial performance may not be a reliable indicator of future performance and historical trends should not be used to anticipate results or trends in future periods. If any of the following risks and uncertainties develops into actual events, these events could have a material adverse effect on our business, financial condition or results of operations. In such case, you could lose all or a portion of your investment in the Notes._",N/A,as_expected,2020,73
1614_1,Offerings 2020.md,14,USE OF PROCEEDS,14.1,,14.1.1,,"We estimate that the net proceeds from the sale of the Notes offered hereby, after deducting the initial purchasers’ discounts and other estimated offering fees and expenses payable by us, will be approximately $       million. We intend to use the net proceeds from this offering, together with cash on hand, to repay a portion of the borrowings outstanding under our Revolving Credit Facility and to pay related fees and expenses. Certain of the initial purchasers, or an affiliate or affiliates thereof, are or may be lenders and/or agents under the Credit Facilities and such initial purchasers or their affiliates may receive a portion of the net proceeds of this offering in connection with the repayment of a portion of the outstanding borrowings under our Revolving Credit Facility. See “Plan of Distribution.” -----",N/A,as_expected,2020,73
1614_1,Offerings 2020.md,15,CAPITALIZATION,15.1,"As of June 30, 2020 (in millions)** **Actual** **As adjusted",15.1.1,,Cash and cash equivalents[(1)] .......................................................... $664 $664,N/A,as_expected,2020,73
1614_1,Offerings 2020.md,15,CAPITALIZATION,15.2,Debt,15.2.1,,"Revolving Credit Facility[(2)] ....................................................... $734 $384 Term Loan Facility[(3)] ................................................................. $1,561 $1,561 5.375% Notes due 2026[(3)].......................................................... $495 $495 Notes offered hereby[(4)] .............................................................. — 350 Finance leases ............................................................................ 57 57 Total debt............................................................................... 2,847 2,847 Total stockholders’ equity / net investment ............................... 933 933 Total Capitalization .....................................................................** $3,780 $3,780 (1) Does not reflect cash on hand expected to be used to pay fees and expenses related to the notes offering and the use of proceeds therefrom. (2) As of June 30, 2020, we had approximately $734 million of borrowings outstanding under the Revolving Credit Facility and $15 million allocated to letters of credit, representing substantially all of our outstanding availability under our revolving credit facility. We plan to use the net proceeds from this offering, together with cash on hand, to repay $350 million of the borrowings outstanding under our Revolving Credit Facility and to pay related fees and expenses. (3) The carrying amount of the term loan and senior unsecured notes are net of deferred debt issuance costs of $16 million as of June 30, 2020. (4) Represents the principal amount of the Notes offered hereby, excluding any offering discount or premium. -----",N/A,as_expected,2020,73
1614_1,Offerings 2020.md,15,CAPITALIZATION,15.3,,15.3.1,,"The following table sets forth our cash and cash equivalents and capitalization as of June 30, 2020 on (i) an actual basis and (ii) an as adjusted basis after giving effect to this offering and the use of proceeds therefrom. The following table should be reviewed in conjunction with the sections entitled “Summary—Summary Historical Financial Data of Wyndham Hotels & Resorts” and our audited Consolidated and Combined Financial Statements and related notes thereto, in each case included elsewhere in this offering memorandum.",N/A,as_expected,2020,73
1614_1,Offerings 2020.md,124,DESCRIPTION OF NOTES,124.1,General,124.1.1,,"The notes: - will be our senior unsecured obligations; - will rank equally in right of payment with all of our other senior Indebtedness from time to time outstanding, including obligations under the Credit Agreement and the Existing Notes; - will be structurally subordinated to all existing and future obligations of our subsidiaries that are not guarantors including claims with respect to trade payables; - will be effectively subordinated to all our existing and future secured obligations, including our obligations under the Credit Agreement, to the extent of the value of the collateral securing such obligations; - will initially be limited to $350.0 million aggregate principal amount; and - will be issued in minimum denominations of $2,000 and integral multiples of $1,000 in excess thereof. The guarantees: - will be the senior unsecured obligations of each guarantor; - will rank equally in right of payment with all of the guarantors’ other senior Indebtedness from time to time outstanding, including obligations under the Credit Agreement and the Existing Notes; and - will be effectively subordinated to all of the guarantors’ existing and future secured obligations, including the guarantors’ obligations under the Credit Agreement, to the extent of the value of the collateral securing such obligations.",N/A,as_expected,2020,73
1614_1,Offerings 2020.md,124,DESCRIPTION OF NOTES,124.2,"Principal, Maturity and Interest",124.2.1,,"The notes will bear interest at the rate of     % per year. Interest will be payable semi-annually in arrears on and       of each year, beginning on      , 2021, and will be computed on the basis of a 360-day year of twelve 30-day months. Interest on the notes will accrue from and including the settlement date and will be paid to holders of record on the       or       immediately before the respective interest payment date. The notes will mature on      , 2028, at which time the holders of notes will be entitled to receive 100% of the outstanding principal amount of the notes. The notes do not have the benefit of any sinking fund. If any interest payment date falls on a day that is not a business day, then payment of interest may be made on the next succeeding business day and no interest will accrue because of such delayed payment. With respect to the notes, when ----- we use the term “business day” we mean any day except a Saturday, a Sunday or a day on which banking institutions in the applicable place of payment are authorized or obligated by law, regulation or executive order to close.",N/A,as_expected,2020,73
1614_1,Offerings 2020.md,124,DESCRIPTION OF NOTES,124.3,Guarantees,124.3.1,,"The notes will be guaranteed on a full and unconditional senior unsecured basis initially by each of our subsidiaries that guarantees our obligations under the Credit Agreement and the Existing Notes. The guarantors will fully and unconditionally guarantee the payment of all of the principal of, and any premium and interest on, the notes when due, whether at maturity or otherwise. Each guarantee will be limited as the issuer deems necessary to prevent such guarantee from being rendered voidable under applicable law relating to fraudulent conveyance or fraudulent transfer or similar laws affecting the rights of creditors generally. Such limitations may not be successful. Each guarantor that makes a payment under its guarantee will be entitled to a contribution from each other guarantor in an amount equal to such other guarantor’s pro rata portion of such payment based on the respective net assets of all the guarantors at the time of such payment. If a guarantee were to be rendered voidable, it could be subordinated by a court to all other Indebtedness (including guarantees and other contingent liabilities) of the applicable guarantor and, depending on the amount of such Indebtedness, a guarantor’s liability on its guarantee could be reduced to zero. In addition, if, after the first original issue date of the notes, a Domestic Subsidiary enters into guarantees (such guarantee being referred to as the “Triggering Guarantee”) of Senior Indebtedness of the issuer under the Credit Agreement, then the issuer will, within 10 business days, cause such Domestic Subsidiary to execute and deliver to the Trustee a supplemental indenture pursuant to which such Domestic Subsidiary will guarantee payment of the notes on the same terms and conditions as the original guarantees from the initial guarantors with such limitations as are set forth in the Triggering Guarantee. A guarantor will be automatically released and relieved from all its obligations under its guarantee in the following circumstances: (a) upon the sale or other disposition (including by way of consolidation or merger), in one transaction or a series of related transactions, of at least a majority of the total voting power of the capital stock or other interests in such guarantor (other than to the issuer or any of its Domestic Subsidiaries), as permitted under the indenture; (b) upon the sale or disposition of all or substantially all the assets of such guarantor (other than to the issuer or any of its Domestic Subsidiaries), as permitted under the indenture; or (c) if at any time such guarantor no longer guarantees (or which guarantee is being simultaneously released or will be immediately released after the release of the guarantor) the Senior Indebtedness of the issuer under the Credit Agreement. “Senior Indebtedness” means, with respect to any Person, Indebtedness of such Person, whether outstanding on the date of the indenture or thereafter incurred unless, in the instrument creating or evidencing the same or pursuant to which the same is outstanding, it is provided that such obligations are subordinate in right of payment to the notes; provided, however, that Senior Indebtedness shall not include (1) any Indebtedness of such Person owing to any Subsidiary of the issuer; or (2) any Indebtedness of such Person (and any accrued and unpaid interest in respect thereof) which is subordinate or junior in any respect to any other Indebtedness of such Person. For the avoidance of doubt, the indenture will not treat (1) unsecured Indebtedness as subordinated or junior to secured Indebtedness merely because it is unsecured or (2) Senior Indebtedness as subordinated or junior in right of payment to any other Senior Indebtedness merely because it has a junior priority with respect to the same collateral or is secured by different collateral or because it is guaranteed by different obligors.",N/A,as_expected,2020,73
1614_1,Offerings 2020.md,124,DESCRIPTION OF NOTES,124.4,Ranking,124.4.1,,"The notes will be our general unsecured obligations and will rank equally with all of our existing and future unsubordinated obligations. Holders of any secured Indebtedness will have claims that are prior to your claims as holders of the notes, to the extent of the value of the assets securing such Indebtedness, in the event of any bankruptcy, liquidation or similar proceeding. The indenture will provide that our obligations under the Credit Agreement shall, with respect to the assets of the issuer and ----- its subsidiaries that constitute or purport to constitute collateral thereunder, be treated for all purposes as secured by such assets including in any insolvency proceeding, with the obligations under the notes treated for all purposes as not secured thereby, and the secured parties under the Credit Agreement shall be third party beneficiaries of this provision. We conduct our operations through our Subsidiaries. As a result, distributions or advances from our Subsidiaries are a major source of funds necessary to meet our debt service and other obligations. Contractual provisions, laws or regulations, as well as our Subsidiaries’ financial condition and operating requirements, may limit our ability to obtain cash required to pay our debt service obligations, including payments on the notes. The notes will be “structurally” subordinated to all obligations of our Subsidiaries that are not guarantors, including claims with respect to trade payables. This means that in the event of bankruptcy, liquidation or reorganization of any of our Subsidiaries that are not guarantors, the holders of notes will have no direct claim to participate in the assets of such Subsidiary but may only recover by virtue of our equity interest in our Subsidiaries (except to the extent we have a claim as a creditor of such Subsidiary). As a result, all existing and future liabilities of our Subsidiaries that are not guarantors, including trade payables and claims of lessors under leases, have the right to be satisfied in full prior to our receipt of any payment as an equity owner of our Subsidiaries. As of June 30, 2020, on a pro forma basis giving effect to the notes offered hereby and the use of proceeds therefrom, our non-guarantor subsidiaries would have had no indebtedness or other liabilities outstanding. Any such indebtedness or other liabilities would have been structurally senior to the notes because holders of the notes will not have direct claims against such non-guarantors. In addition, the notes will be “effectively” subordinated to all of our secured obligations, including our obligations under the Credit Agreement. This means that in the event of bankruptcy, liquidation or reorganization, our secured creditors will have priority over the holders of notes to the extent of the value of the collateral securing such secured obligations. As of June 30, 2020, on a pro forma basis giving effect to the notes offered hereby and the use of proceeds therefrom, we would have had approximately $1,561 million of secured indebtedness outstanding under the Term Loan Credit Facility and approximately $384 million of secured indebtedness outstanding under the Revolving Credit Facility, excluding $15 million allocated to letters of credit, all of which would have been effectively senior to the notes, as described under “Use of Proceeds” and “Capitalization.”",N/A,as_expected,2020,73
1614_1,Offerings 2020.md,124,DESCRIPTION OF NOTES,124.5,Further Issues,124.5.1,,"The indenture will provide that we may issue additional debt securities thereunder from time to time in one or more series, and permits us to establish the terms of each series of debt securities at the time of issuance. The indenture does not limit the aggregate amount of debt securities that may be issued under the indenture. Under the indenture, we may, from time to time, without the consent of the holders of the notes, issue notes having the same terms in all respects as the notes originally issued (other than the issuance date, the issuance price and, if applicable, the amount and date of the first payment of interest) (the “additional notes”); provided that if the additional notes are not fungible with the notes for United States federal income tax purposes, the additional notes will have a separate CUSIP number.",N/A,as_expected,2020,73
1614_1,Offerings 2020.md,124,DESCRIPTION OF NOTES,124.6,Optional Redemption,124.6.1,,"At any time prior to      , 2023, we may, at our option, at any time and from time to time, redeem all or any portion of the notes on not less than 10 nor more than 60 days’ prior notice mailed (or, in the case of global notes, delivered electronically in accordance with the procedures of DTC) to registered holders of the notes to be redeemed at a redemption price equal to the greater of: - 100% of the principal amount plus accrued and unpaid interest to, but excluding, the redemption date; and - the sum, as determined by an Independent Investment Banker, of the present value of the redemption price of the notes at    , 2023 (such redemption price being set forth in the table appearing below) plus the remaining scheduled payments of principal and interest (exclusive of interest accrued to the date of redemption) discounted to    , 2023 on a semiannual basis (assuming a 360-day year consisting of twelve 30-day months) at the Treasury Rate plus       basis points, plus accrued and unpaid interest to, but excluding, the date of redemption. At any time and from time to time on or after      , 2023, we may redeem the notes in whole or in part, at our option, upon not less than 10 nor more than 60 days’ prior notice mailed (or, in the case of global notes, delivered electronically in accordance with the procedures of DTC) to registered holders of the notes to be redeemed at a redemption price equal the percentage of principal amount set forth below plus accrued and unpaid interest, if any, on the Notes ----- redeemed, to, but excluding, the applicable date of redemption, if redeemed during the twelve-month period beginning on of the year indicated below:",N/A,as_expected,2020,73
