Prospectus ID,Original Filename,Section ID,Section Title,Subsection ID,Subsection Title,Subsubsection ID,Subsubsection Title,Subsubsection Text,Parsing Error,From Folder,Prospectus Year,PDF Page Count
1614_1,Offerings 2020.md,124,DESCRIPTION OF NOTES,124.17,SEC Reports,124.17.1,,"The indenture will provide that (i) any documents or reports that we are required to file with the SEC pursuant to Section 13 or 15(d) of the Exchange Act must be filed by us with the Trustee within 15 days after the same are required to be filed with the SEC (giving effect to any grace period provided by Rule 12b-25 under the Exchange Act) and (ii) whether or not we are subject to Section 13 or 15(d) of the Exchange Act, we will, within 30 days after each of the respective dates by which we would have been required to file annual reports or quarterly reports if we were so subject, furnish to the Trustee (a) all financial statements that would be required to be contained in an annual report on Form 10-K, or any successor or comparable form, filed with the SEC, a “Management’s Discussion and Analysis of Financial Condition and Results of Operations,” and a report on the annual financial statements by the issuer’s independent registered public accounting firm and (b) after the end of each of the first three fiscal quarters of each fiscal year, all financial statements that would be required to be contained in a quarterly report on Form 10-Q, or any successor or comparable form, filed with the SEC. Substantially concurrently with the furnishing or making such information available to the Trustee pursuant to clause (ii) of the immediately preceding sentence, the issuer shall also post copies of such information required by clause (ii) of the immediately preceding sentence on a website (which may be nonpublic and may be maintained by the issuer or a third party) to which access will be given to holders. Notwithstanding anything to the contrary set forth above, if the issuer or any parent entity of the issuer has furnished to the holders of the notes and the Trustee or filed with the SEC the reports described above with respect to the issuer or any parent entity of the issuer, the issuer shall be deemed to be in compliance with the requirements set forth in the paragraph above; provided that, if the financial information so furnished relates to any parent entity of the issuer, the same is ----- accompanied by consolidating information, that explains in reasonable detail the differences between the information relating to such parent entity, on the one hand, and the information relating to the issuer on a standalone basis, on the other hand. For the avoidance of doubt, the consolidating information referred to in the proviso in the preceding sentence need not be audited. In addition, the issuer and the guarantors have agreed that they will make available to the holders and to prospective investors, upon the request of such holders, the information required to be delivered pursuant to Rule 144A(d)(4) under the Securities Act so long as the notes are not freely transferable under the Securities Act. For purposes of this covenant, the issuer and the guarantors will be deemed to have furnished the reports to the Trustee and the holders of notes as required by this covenant if it has filed such reports with the SEC via the EDGAR filing system or such reports are publicly available. Notwithstanding anything contained herein, if not filed with the SEC but made publicly available to the Trustee and the registered holders of the notes in the event that the issuer or the parent is not subject to the reporting requirements of Section 13 or 15(d) of the Exchange Act, (a) such information will not be required to comply with Section 302 or Section 404 of the Sarbanes-Oxley Act of 2002, or related Items 307 and 308 of Regulation S-K promulgated by the SEC and (b) such information will not be required to contain the separate financial information for Guarantors as contemplated by Rule 3-10 of Regulation S-X or Subsidiaries whose securities are pledged to secure the Notes as contemplated by Rule 3-16 of Regulation S-X or any financial statements of unconsolidated Subsidiaries or 50% or less owned persons as contemplated by Rule 3-09 of Regulation S-X or any schedules required by Regulation S-X, or in each case any successor provisions. The Trustee will have no responsibility to determine whether the filing of such financial statements has occurred. Delivery of such reports, information, and documents to the Trustee is for informational purposes only and the Trustee’s receipt of such shall not constitute constructive notice of any information contained therein or determinable from information contained therein, including the issuer’s compliance with any of its covenants under the indenture (as to which the Trustee is entitled to rely on officer’s certificates).",N/A,as_expected,2020,73
1614_1,Offerings 2020.md,124,DESCRIPTION OF NOTES,124.18,Events of Default,124.18.1,,"Holders of notes will have specified rights if an Event of Default (as defined below) occurs. The term “Event of Default” in respect of the notes means any of the following: - we do not pay interest, including any additional interest and any additional amounts, on any note within 30 days of its due date; - we do not pay the principal of or any premium on any note, including any additional amount, when due and payable, at maturity, or upon acceleration or redemption; - we remain in breach of a covenant or warranty in respect of the indenture or any note (other than a covenant included in the indenture solely for the benefit of debt securities of another series of notes) for 90 days after we receive a written notice of default, which notice must be sent by either the Trustee or holders of at least 30% in principal amount of the outstanding notes; - a default resulting in acceleration of Indebtedness of ours or any of our Restricted Subsidiaries other than intercompany Indebtedness of at least $75 million in aggregate principal amount, which acceleration has not been rescinded or annulled after 45 days’ notice thereof; - we or any of our significant subsidiaries file for bankruptcy, or other events of bankruptcy, insolvency or reorganization specified in the indenture; or - a final judgment for the payment of $75 million or more (excluding any amounts covered by insurance or indemnities) rendered against us or any of our significant subsidiaries, which judgment is not discharged or stayed within 60 days after (i) the date on which the right to appeal thereof has expired if no such appeal has commenced, or (ii) the date on which all rights to appeal have been extinguished. If an Event of Default with respect to the notes has occurred and is continuing, the Trustee or the holders of at least 30% in principal amount of the notes may, by written notice to the issuer (with a copy to the Trustee, if given by such holders), declare the entire unpaid principal amount of (and premium, if any), and all the accrued interest on, such notes to be due and immediately payable. This is called a declaration of acceleration of maturity. There is no action on the part of the Trustee or any holder of the notes required for such declaration if the Event of Default is the issuer’s bankruptcy, insolvency ----- or reorganization. Holders of a majority in principal amount of the notes may also waive certain past defaults under the indenture with respect to the notes on behalf of all of the holders of the notes. A declaration of acceleration of maturity may be canceled, under specified circumstances, by the holders of at least a majority in principal amount of notes and the Trustee. A court of competent jurisdiction shall have the power to stay any cure period under the indenture in the event of litigation regarding whether a default or Event of Default has occurred. A notice of default may not be given with respect to any action taken, and reported publicly to holders, more than two years prior to such notice of default. Any notice of default, notice of acceleration or instruction to the Trustee to provide a notice of default, notice of acceleration or take any other action (a “Noteholder Direction”) provided by any one or more holders (each, a “Directing Holder”) must be accompanied by a written representation from each such holder to the issuer and the Trustee that such holder is not (or, in the case such holder is DTC or its nominee, that such holder is being instructed solely by beneficial owners that are not) Net Short (a “Position Representation”), which representation, in the case of a Noteholder Direction relating to a notice of default shall be deemed repeated at all times until the resulting Event of Default is cured or otherwise ceases to exist or the notes are accelerated. In addition, each Directing Holder must, at the time of providing a Noteholder Direction, covenant to provide the issuer with such other information as the issuer may reasonably request from time to time in order to verify the accuracy of such Directing Holder’s Position Representation within five business days of request therefor (a “Verification Covenant”). In any case in which the holder is DTC or its nominee, any Position Representation or Verification Covenant required hereunder shall be provided by the beneficial owner of the notes in lieu of DTC or its nominee, and DTC shall be entitled to rely on such Position Representation and Verification Covenant in delivering its direction to the Trustee. If, following the delivery of a Noteholder Direction, but prior to acceleration of the notes, the issuer determines in good faith that there is a reasonable basis to believe a Directing Holder was, at any relevant time, in breach of its Position Representation and provide to the Trustee evidence that the issuer has initiated litigation in a court of competent jurisdiction seeking a determination that such Directing Holder was, at such time, in breach of its Position Representation, and seeking to invalidate any Event of Default that resulted from the applicable Noteholder Direction, the cure period with respect to such default shall be automatically stayed and the cure period with respect to such Event of Default shall be automatically reinstituted and any remedy stayed pending a final and non-appealable determination of a court of competent jurisdiction on such matter. If, following the delivery of a Noteholder Direction, but prior to acceleration of the notes, the issuer provides to the Trustee an Officer’s Certificate stating that a Directing Holder failed to satisfy its Verification Covenant, the cure period with respect to such default shall be automatically stayed and the cure period with respect to any Event of Default that resulted from the applicable Noteholder Direction shall be automatically reinstituted and any remedy stayed until such time as the issuer provides the Trustee with an Officer’s Certificate that the Verification Covenant has been satisfied; provided that the issuer shall promptly deliver such Officer’s Certificate to the Trustee upon becoming aware that the Verification Covenant has been satisfied. Any breach of the Position Representation (as evidenced by the delivery to the Trustee of the Officer’s Certificate stating that a Directing Holder failed to satisfy its Verification Covenant) shall result in such holder’s participation in such Noteholder Direction being disregarded; and if, without the participation of such holder, the percentage of notes held by the remaining holders that provided such Noteholder Direction would have been insufficient to validly provide such Noteholder Direction, such Noteholder Direction shall be void ab initio, with the effect that such Event of Default shall be deemed never to have occurred, acceleration voided and the Trustee shall be deemed not to have received such Noteholder Direction or any notice of such default or Event of Default. Notwithstanding anything in the preceding two paragraphs to the contrary, any Noteholder Direction delivered to the Trustee during the pendency of an Event of Default as the result of a bankruptcy or similar direction shall not require compliance with the foregoing paragraphs. For the avoidance of doubt, the Trustee shall be entitled to conclusively rely on any Noteholder Direction delivered to it in accordance with the indenture, shall have no duty to inquire as to or investigate the accuracy of any Position Representation, enforce compliance with any Verification Covenant, verify any statements in any Officer’s Certificate delivered to it, or otherwise make calculations, investigations or determinations with respect to Derivative Instruments, Net Shorts, Long Derivative Instruments, Short Derivative Instruments or otherwise. The Trustee shall have no liability or responsibility to us, any holder or any other Person in connection with any Noteholder Direction or to determine whether or not any holder has delivered a Position Representation or that such Position Representation conforms with the indenture or any other agreement and can rely conclusively on the Officer’s Certificate delivered by the issuer and determinations made by a court of competent jurisdiction. The Trustee shall not be deemed to have notice of any default or Event of Default unless a responsible officer of the Trustee has received, at the corporate trust office, written notification specifying such default or Event of Default. Notwithstanding the foregoing, the indenture will provide that, to the extent we elect, the sole remedy for an Event of Default relating to our failure to comply with our obligations as set forth under “—SEC Reports,” will after the occurrence of such an Event of Default, consist exclusively of the right to receive additional interest on the notes at a rate equal to: ----- - 0.25% per annum of the principal amount of the notes outstanding for each day during the 60-day period beginning on, and including, the occurrence of such an Event of Default during which such Event of Default is continuing; and - 0.50% per annum of the principal amount of the notes outstanding for each day during the 120-day period beginning on, and including, the 61st day following, and including, the occurrence of such an Event of Default during which such Event of Default is continuing; provided, however, that in no event shall additional interest accrue under the terms of the indenture at an annual rate in excess of 0.50% during the six-month period beginning on, and including, the date which is six months after the last date of original issuance of the notes for any failure to timely file any document or report that we are required to file with the SEC pursuant to Section 13 or 15(d) of the Exchange Act, as applicable (after giving effect to all applicable grace periods thereunder and other than reports on Form 8-K). If we so elect, such additional interest will be payable in the same manner and on the same dates as the stated interest payable on the notes. On the 181st day after such Event of Default (if the Event of Default relating to the reporting obligations is not cured or waived prior to such 181st day), the notes will be subject to acceleration as provided above. The provisions of the indenture described in this paragraph will not affect the rights of holders of the notes in the event of the occurrence of any other Event of Default. In the event we do not elect to pay the additional interest following an Event of Default in accordance with this paragraph, the notes will be subject to acceleration as provided above. In order to elect to pay the additional interest as the sole remedy during the first 180 days after the occurrence of an Event of Default relating to the failure to comply with the reporting obligations in accordance with the immediately preceding paragraph, we must notify all holders of the notes and the Trustee and paying agent of such election prior to the beginning of such 180-day period. Upon our failure to timely give such notice, the notes will be immediately subject to acceleration as provided above. Except in cases of default, where the Trustee has special duties, the Trustee is not required to take any action under the indenture at the request of holders unless the holders offer the Trustee protection from expenses and liability satisfactory to the Trustee. If an indemnity satisfactory to the Trustee is provided, the holders of a majority in principal amount of the notes may direct the time, method and place of conducting any lawsuit or other formal legal action seeking any remedy available to the Trustee. The Trustee may refuse to follow those directions in certain circumstances specified in the indenture. No delay or omission in exercising any right or remedy will be treated as a waiver of the right, remedy or Event of Default. Before holders are allowed to bypass the Trustee and bring a lawsuit or other formal legal action or take other steps to enforce their rights or protect their interests relating to the notes, the following must occur: - such holders must give the Trustee written notice that an Event of Default has occurred and remains uncured; - holders of at least 30% in principal amount of the notes must make a written request that the Trustee take action because of the default and must offer the Trustee indemnity satisfactory to the Trustee against any losses, liabilities or expenses of taking that action; and - the Trustee must have failed to take action for 60 days after receipt of the notice and offer of indemnity. Holders are, however, entitled at any time to bring a lawsuit for the payment of money due on the notes on or after the due date.",N/A,as_expected,2020,73
1614_1,Offerings 2020.md,124,DESCRIPTION OF NOTES,124.19,Modification of the Indenture,124.19.1,,"The indenture will provide that we and the Trustee may, without the consent of any holders of the notes, amend the notes and the indenture for the purposes, among other things, of: - curing ambiguities, omissions, mistakes, defects or inconsistencies; - providing for the assumption by a successor corporation of the obligations of the issuer under the indenture or the notes; - adding guarantees with respect to the notes; ----- - securing the notes or confirming and evidencing the release, termination, discharging or retaking of any guarantee or Lien with respect to securing the notes when such release, termination or discharge is provided for under the indenture or the notes or any applicable collateral document; - adding to the covenants of the issuer for the benefit of some or all of the holders or surrendering any right or power conferred upon the issuer; - adding additional events of default; - making any change that does not adversely affect in any material respect the rights of any holder under the indenture; - changing or eliminating any provisions of the indenture so long as there are no holders entitled to the benefit of the provisions; - complying with any requirement of the SEC in connection with the qualification of the indenture under the Trust Indenture Act of 1939, as amended; - conforming the provisions of the indenture and the notes to the “Description of Notes” section in this offering memorandum; - supplementing any of the provisions of the indenture to such extent as shall be necessary to permit or facilitate the defeasance and discharge of the notes so long as any such action shall not adversely affect the interests of any holder of the notes; - permitting the authentication and delivery of additional notes; - providing for uncertificated notes in addition to or in place of certificated notes subject to applicable laws; - evidencing the acceptance of appointment by a successor trustee or paying agent; - complying with obligations under “—Merger, Consolidation or Sale of Assets”; - evidencing the release of any guarantor pursuant to the terms of the indenture; or - making any amendment to the provisions of the indenture or the notes to eliminate the effect of any Accounting Change or in the application thereof as described in the last paragraph of the definition of “GAAP.”. With specific exceptions, the indenture or the rights of the holders of notes may be modified by us and the Trustee with the consent of the holders of a majority in aggregate principal amount of notes, but no modification may be made without the consent of the holder of each outstanding note that would: - extend the maturity of any payment of principal of or any installment of interest on the notes; - reduce the principal amount of any note, or the interest thereon, or any premium payable on any note upon redemption thereof; - change our obligation to pay additional amounts; - change any place of payment where, or the currency in which, any note or any premium or interest is denominated as payable; - change the ranking of the notes; - impair the right to sue for the enforcement of any payment on or with respect to any note; or - reduce the percentage in principal amount of outstanding notes required to consent to any supplemental indenture, any waiver of compliance with provisions of the indenture or specific defaults and their ----- consequences provided for in the indenture, or otherwise modify the sections in the indenture relating to these consents.",N/A,as_expected,2020,73
1614_1,Offerings 2020.md,124,DESCRIPTION OF NOTES,124.20,Defeasance and Covenant Defeasance,124.20.1,,"We may elect either (i) to defease and be discharged from any and all obligations with respect to the notes (except as otherwise provided in the indenture) (“defeasance”) or (ii) to be released from our obligations with respect to certain covenants that are described in the indenture (“covenant defeasance”), upon the deposit with the Trustee, in trust for such purpose, of money and/or government obligations that through the payment of principal and interest in accordance with their terms will provide money in an amount sufficient, without reinvestment, to pay the principal of, premium, if any, and interest on the notes to maturity or redemption, as the case may be, and any mandatory sinking fund or analogous senior payments thereon. As a condition to defeasance or covenant defeasance, we must deliver to the Trustee an opinion of counsel to the effect that the holders of the notes will not recognize income, gain or loss for United States federal income tax purposes as a result of such defeasance or covenant defeasance and will be subject to United States federal income tax on the same amounts, in the same manner and at the same times as would have been the case if such defeasance or covenant defeasance had not occurred. Such opinion of counsel, in the case of defeasance under clause (i) above, must refer to and be based upon a ruling of the Internal Revenue Service or a change in applicable United States federal income tax law occurring after the date of the indenture. We may exercise our defeasance option with respect to debt securities notwithstanding our prior exercise of our covenant defeasance option. If we exercise our defeasance option, payment of such notes may not thereafter be accelerated because of an Event of Default. If we exercise our covenant defeasance option, payment of such notes may not thereafter be accelerated by reference to any covenant from which we are released as described under clause (ii) of the immediately preceding paragraph. However, if acceleration were to occur for other reasons, the realizable value at the acceleration date of the money and government obligations in the defeasance trust could be less than the principal and interest then due on such notes, in that the required deposit in the defeasance trust is based upon scheduled cash flows rather than market value, which will vary depending upon interest rates and other factors.",N/A,as_expected,2020,73
