Prospectus ID,Original Filename,Section ID,Section Title,Subsection ID,Subsection Title,Subsubsection ID,Subsubsection Title,Subsubsection Text,Parsing Error,From Folder,Prospectus Year,PDF Page Count
253_2,Preliminary Offerings 2021.md,549,PROSPECTUS,549.1,"You should carefully read this prospectus and any accompanying prospectus supplement, together with the documents incorporated by reference herein and therein, and any free writing prospectus, before you make an investment decision.",549.1.1,,##### Investing in our securities involves risks. You should consider the risk factors described in any accompanying prospectus supplement and the documents we incorporate by reference. See “Risk Factors” on page 4 of this prospectus.,N/A,as_expected,2021,146
253_2,Preliminary Offerings 2021.md,549,PROSPECTUS,549.2,"Neither the Securities and Exchange Commission nor any state securities commission has approved or disapproved of these securities or passed upon the adequacy or accuracy of this prospectus. Any representation to the contrary is a criminal offense. The date of this prospectus is October 27, 2021.",549.2.1,,----- ###### PROSPECTUS SUPPLEMEN None NYM CLN PS PMT 1C,N/A,as_expected,2021,146
253_2,Preliminary Offerings 2021.md,549,PROSPECTUS,549.3,,549.3.1,,"# TEVA PHARMACEUTICAL INDUSTRIES LIMITED ## American Depositary Shares, each representing one Ordinary Share, Debt Securities, Purchase Contracts and Units #### TEVA PHARMACEUTICAL FINANCE IV, LLC TEVA PHARMACEUTICAL FINANCE V, LLC TEVA PHARMACEUTICAL FINANCE VI, LLC TEVA PHARMACEUTICAL FINANCE NETHERLANDS II B.V. TEVA PHARMACEUTICAL FINANCE NETHERLANDS III B.V. TEVA PHARMACEUTICAL FINANCE NETHERLANDS IV B.V.",N/A,as_expected,2021,146
253_2,Preliminary Offerings 2021.md,1,TABLE OF CONTENTS,1.1,,1.1.1,,ABOUT THIS PROSPECTUS . . . . . . . . . . . . . . . . . . . . . . . . . . . . . . . . . . . . . . . . . . . . . . . . . . . . . . . . . . . . . . 1 TEVA PHARMACEUTICAL INDUSTRIES LIMITED . . . . . . . . . . . . . . . . . . . . . . . . . . . . . . . . . . . . . . . . . . 2 FINANCE SUBSIDIARIES . . . . . . . . . . . . . . . . . . . . . . . . . . . . . . . . . . . . . . . . . . . . . . . . . . . . . . . . . . . . . . . . 3 RISK FACTORS . . . . . . . . . . . . . . . . . . . . . . . . . . . . . . . . . . . . . . . . . . . . . . . . . . . . . . . . . . . . . . . . . . . . . . . . . 4 FORWARD-LOOKING STATEMENTS . . . . . . . . . . . . . . . . . . . . . . . . . . . . . . . . . . . . . . . . . . . . . . . . . . . . . 5 USE OF PROCEEDS . . . . . . . . . . . . . . . . . . . . . . . . . . . . . . . . . . . . . . . . . . . . . . . . . . . . . . . . . . . . . . . . . . . . . 7 DESCRIPTION OF ORDINARY SHARES . . . . . . . . . . . . . . . . . . . . . . . . . . . . . . . . . . . . . . . . . . . . . . . . . . . 8 DESCRIPTION OF AMERICAN DEPOSITARY SHARES . . . . . . . . . . . . . . . . . . . . . . . . . . . . . . . . . . . . . . 14 DESCRIPTION OF DEBT SECURITIES AND GUARANTEES . . . . . . . . . . . . . . . . . . . . . . . . . . . . . . . . . . . 24 DESCRIPTION OF PURCHASE CONTRACTS . . . . . . . . . . . . . . . . . . . . . . . . . . . . . . . . . . . . . . . . . . . . . . . 34 DESCRIPTION OF UNITS . . . . . . . . . . . . . . . . . . . . . . . . . . . . . . . . . . . . . . . . . . . . . . . . . . . . . . . . . . . . . . . . 35 TAXATION . . . . . . . . . . . . . . . . . . . . . . . . . . . . . . . . . . . . . . . . . . . . . . . . . . . . . . . . . . . . . . . . . . . . . . . . . . . . 36 PLAN OF DISTRIBUTION . . . . . . . . . . . . . . . . . . . . . . . . . . . . . . . . . . . . . . . . . . . . . . . . . . . . . . . . . . . . . . . . 37 EXPERTS . . . . . . . . . . . . . . . . . . . . . . . . . . . . . . . . . . . . . . . . . . . . . . . . . . . . . . . . . . . . . . . . . . . . . . . . . . . . . . 40 LEGAL MATTERS . . . . . . . . . . . . . . . . . . . . . . . . . . . . . . . . . . . . . . . . . . . . . . . . . . . . . . . . . . . . . . . . . . . . . . 40 WHERE YOU CAN FIND MORE INFORMATION . . . . . . . . . . . . . . . . . . . . . . . . . . . . . . . . . . . . . . . . . . . . 41 ENFORCEMENT OF CIVIL LIABILITIES . . . . . . . . . . . . . . . . . . . . . . . . . . . . . . . . . . . . . . . . . . . . . . . . . . . 43 ----- ###### PROSPECTUS SUPPLEMEN None NYM CLN PS PMT 1C,N/A,as_expected,2021,146
253_2,Preliminary Offerings 2021.md,550,ABOUT THIS PROSPECTUS,550.1,TEVA PHARMACEUTICAL INDUSTRIES LIMITED Business Overview,550.1.1,,"We are a global pharmaceutical company, committed to helping patients around the world to access affordable medicines and benefit from innovations to improve their health. Our mission is to be a global leader in generics, specialty medicines and biopharmaceuticals, improving the lives of patients. We operate worldwide, with headquarters in Israel and a significant presence in the United States, Europe and many other markets around the world. Our key strengths include our world-leading generic medicines expertise and portfolio, focused specialty medicines portfolio and global infrastructure and scale. Teva was incorporated in Israel on February 13, 1944 and is the successor to a number of Israeli corporations, the oldest of which was established in 1901.",N/A,as_expected,2021,146
253_2,Preliminary Offerings 2021.md,550,ABOUT THIS PROSPECTUS,550.2,Our Business Segments,550.2.1,,"We operate our business through three segments: North America, Europe and International Markets. Each business segment manages our entire product portfolio in its region, including generics, specialty and over-the-counter (“OTC”) products. This structure enables strong alignment and integration between operations, commercial regions, R&D and our global marketing and portfolio function, optimizing our product lifecycle across therapeutic areas. In addition to these three segments, we have other activities, primarily the sale of active pharmaceutical ingredients (“API”) to third parties, certain contract manufacturing services and an out-licensing platform offering a portfolio of products to other pharmaceutical companies through our affiliate Medis. 2 ----- ###### PROSPECTUS SUPPLEMEN START PAGE NYM CLN PS PMT 1C",N/A,as_expected,2021,146
253_2,Preliminary Offerings 2021.md,550,ABOUT THIS PROSPECTUS,550.3,,550.3.1,,"This prospectus is part of a Registration Statement that Teva and the other registrants filed with the United States Securities and Exchange Commission (the “SEC”) as a “well-known seasoned issuer” as defined in Rule 405 under the Securities Act of 1933, as amended (the “Securities Act”), utilizing a “shelf” registration process. Under this shelf process, any of the registrants may, from time to time, sell the securities described in this prospectus in one or more offerings. This prospectus provides you with a general description of the securities which we may offer and the related guarantees, if any, of those securities. Each time we sell securities we will provide a prospectus supplement that will contain specific information about the terms of the offering. The prospectus supplement may also add, update or change information contained in this prospectus. You should read both this prospectus and any prospectus supplement together with additional information described below under the heading “Where You Can Find More Information” before purchasing any of our securities. We have not authorized anyone to provide any information or to make any representation other than those contained or incorporated by reference in this prospectus. “Incorporated by reference” means that we can disclose important information to you by referring you to another document filed separately with the SEC. We have not authorized any other person to provide you with different information. If anyone provides you with different or inconsistent information, you should not rely on it. We are not making, and we will not make, an offer to sell securities in any jurisdiction where the offer or sale is not permitted. You should assume that the information appearing in this prospectus and any supplement to this prospectus is current only as of the dates on their respective covers. Our business, financial condition, results of operations and prospects may have changed since that date. Unless the context otherwise requires, references in this prospectus and any supplement to this prospectus to “Teva,” “we,” “us” and “our” refer to Teva Pharmaceutical Industries Limited and its subsidiaries, collectively. References to “Teva Finance IV LLC” refer to Teva Pharmaceutical Finance IV, LLC. References to “Teva Finance V LLC” refer to Teva Pharmaceutical Finance V, LLC. References to “Teva Finance VI LLC” refer to Teva Pharmaceutical Finance VI, LLC. References to the “LLCs” refer to Teva Finance IV LLC, Teva Finance V LLC and Teva Finance VI LLC. References to “Teva Finance Netherlands II” refer to Teva Pharmaceutical Finance Netherlands II B.V. References to “Teva Finance Netherlands III” refer to Teva Pharmaceutical Finance Netherlands III B.V. References to “Teva Finance Netherlands IV” refer to Teva Pharmaceutical Finance Netherlands IV B.V. References to the “Netherlands BVs” refer to Teva Finance Netherlands II, Teva Finance Netherlands III and Teva Finance Netherlands IV. References to the “finance subsidiaries” refer to the LLCs, and the Netherlands BVs, collectively. ----- ###### PROSPECTUS SUPPLEMEN START PAGE NYM CLN PS PMT 1C",N/A,as_expected,2021,146
253_2,Preliminary Offerings 2021.md,551,FINANCE SUBSIDIARIES,551.1,,551.1.1,,"Teva has organized various finance subsidiaries for the purpose of issuing debt securities. There are no separate financial statements of the finance subsidiaries in this prospectus because these entities are, or will be treated as, subsidiaries of Teva for financial reporting purposes. We do not believe the financial statements would be helpful to the holders of the securities of these entities because: - Teva is a reporting company under the Securities Exchange Act of 1934, as amended (the “Exchange Act”) and owns, directly or indirectly, all of the voting interests of these entities; - these entities do not have any independent operations and do not propose to engage in any activities other than issuing securities and investing the proceeds in Teva or its affiliates; and - these entities’ obligations under the securities will be fully and unconditionally guaranteed by Teva. These entities are exempt from the information reporting requirements of the Exchange Act.",N/A,as_expected,2021,146
253_2,Preliminary Offerings 2021.md,552,DESCRIPTION OF ORDINARY SHARES,552.1,Description of Ordinary Shares,552.1.1,,"The par value of Teva’s ordinary shares is NIS 0.10 per share, and all issued and outstanding ordinary shares are fully paid and non-assessable. Holders of ordinary shares are entitled to participate equally in the receipt of dividends and other distributions and, in the event of liquidation, in all distributions after the discharge of liabilities to creditors. All ordinary shares represented by the ADSs will be issued in registered form only. The Israeli Companies Law, 5759-1999 (the “Companies Law”) and the Articles do not provide for preemptive rights to the holders of Teva’s shares. Each Teva ordinary share entitles the holder thereof to one vote. Neither the Memorandum nor the Articles or the laws of the State of Israel restrict the ownership or voting of Teva’s ordinary shares or ADSs by non-residents or persons who are not citizens of Israel, except with respect to citizens or residents of countries that are in a state of war with Israel.",N/A,as_expected,2021,146
253_2,Preliminary Offerings 2021.md,552,DESCRIPTION OF ORDINARY SHARES,552.2,General Shareholder Meetings,552.2.1,,"Under the Companies Law and the Articles, Teva is required to hold an annual general meeting every calendar year, no later than 15 months after the previous annual general meeting. In addition, Teva is required to convene a special meeting of shareholders: - upon the demand of two directors or one-quarter of the serving directors; - upon the demand of one or more shareholders holding at least 5% of our issued share capital and 1% or more of our voting rights; and - upon the demand of one or more shareholders holding at least 5% of our voting rights; provided that a demand by a shareholder to convene a special shareholders meeting must set forth the matters to be considered at the meeting and otherwise comply with all other requirements of applicable law and the Articles. If the board of directors receives a demand to convene a special meeting satisfying the above conditions, it must announce the scheduling of the meeting within 21 days after the demand was delivered, subject to the relevant requirements of the Companies Law and the regulations thereunder. If the board of directors fails to do so, the party who demanded to convene the special meeting may convene the meeting itself, subject to the provisions of the Companies Law. The agenda of a general meeting is determined by the board of directors. The agenda must also include matters for which the convening of a special meeting was demanded, as well as any matter requested by one or more shareholders who hold at least 1% of Teva’s voting rights, subject to complying with certain requirements. Pursuant to Israeli law, a Teva shareholder who wishes to include a matter on the agenda of a general meeting must submit the request within seven days of publication of the notice with respect to the general meeting or within 14 days of a preliminary notice of the intention to convene the general meeting, if such was filed, in order for it to be eligible to be considered at the general meeting. Under the Articles, a request by a shareholder who holds at least 1% of Teva’s voting rights to include a matter on the agenda of a general meeting must be submitted in writing to Teva no later than 14 days after the first publication of Teva’s annual consolidated financial statements preceding the annual general meeting at which the consolidated financial statements for such year are to be presented. Any such demands or requests must comply with the requirements of applicable law, applicable stock exchange rules and the Articles. 8 ----- ###### PROSPECTUS SUPPLEMEN None NYM CLN PS PMT 1C",N/A,as_expected,2021,146
253_2,Preliminary Offerings 2021.md,552,DESCRIPTION OF ORDINARY SHARES,552.3,Notices,552.3.1,,"Pursuant to the Companies Law, the regulations thereunder and the Articles, Teva is generally required to announce the convening of general meetings at least 35 days in advance, but is not required to deliver personal notices of a general meeting or of any adjournment thereof to shareholders. Teva may reasonably determine the method of publicizing the convening of general meetings, including by publishing a notice in one or more daily newspapers in Israel or in one or more international wire services, and any such publication will be deemed to have been duly given and delivered on the date of such publication. Shareholders as of the record date determined in respect of the general meeting are entitled to participate in and vote at the meeting. The Articles require that shareholder meetings take place in Israel, unless Teva’s center of management has been transferred to another country in accordance with the Articles.",N/A,as_expected,2021,146
253_2,Preliminary Offerings 2021.md,552,DESCRIPTION OF ORDINARY SHARES,552.4,Voting and Quorum Requirements,552.4.1,,"The quorum required for a general meeting of shareholders is at least two shareholders present in person or by proxy or represented by an authorized representative, who jointly hold at least 25% of our paid-up share capital. If a meeting is adjourned for lack of a quorum, it will generally be adjourned to the same time and place on the same day of the following week unless the board of directors sets another date, time and place in a notice to all persons who are entitled to receive notice of general meetings. Should no legal quorum be present at such reconvened meeting a half hour following the time set for such meeting, the necessary quorum consists of any two shareholders present, in person or by proxy, who jointly hold at least 20% of Teva’s paid-up share capital. A shareholder who intends to vote at a meeting must demonstrate ownership of shares in accordance with the Companies Law and the regulations promulgated thereunder.",N/A,as_expected,2021,146
253_2,Preliminary Offerings 2021.md,552,DESCRIPTION OF ORDINARY SHARES,552.5,Shareholder Resolutions,552.5.1,,"The Companies Law provides that resolutions on certain matters, such as amending a company’s articles of association, exercising the authority of the board of directors in certain circumstances, appointing auditors, approving certain transactions, increasing or decreasing the registered share capital and approving certain mergers, must be approved by the shareholders at a general meeting. A company may determine in its articles of association certain additional matters with respect to which decisions will be made by the shareholders at a general meeting. Generally, under the Articles, shareholder resolutions are deemed adopted if approved by the holders of a simple majority of the voting rights represented at a general meeting in person or by proxy and voting, unless a different majority is required by law or the Articles. Pursuant to the Companies Law and the Articles, certain shareholder resolutions (for example, resolutions amending many of the provisions of the Articles) require the affirmative vote of at least 75% of the voting rights represented at a general meeting and voting in person or by proxy, and certain other amendments to the Articles require the affirmative vote of at least 85% of the voting rights represented in a general meeting voting in person or by proxy, unless the board of directors sets a lower percentage, by a supermajority of three-quarters of the voting directors.",N/A,as_expected,2021,146
253_2,Preliminary Offerings 2021.md,552,DESCRIPTION OF ORDINARY SHARES,552.6,Change of Control,552.6.1,,"Subject to certain exceptions, the Companies Law requires that a merger (which, for these purposes, is defined as involving two Israeli companies) be approved by both the board of directors and by the shareholders of each of the merging companies and, with respect to the target company, if its share capital is divided into more than one class, the approval of each class of shares is required (in accordance with the majority and legal quorum requirements set forth in the Companies Law and the Articles). However, a merger may not be approved if it is objected to by shareholders holding a majority of the voting rights participating and voting at the meeting (disregarding any abstentions), after excluding the shares held by the other party to the merger, by any person 9 ----- ###### PROSPECTUS SUPPLEMEN None NYM CLN PS PMT 1C who holds 25% or more of the other party to the merger or by anyone on their behalf, including the relatives of or corporations controlled by these persons, unless an Israeli court determines otherwise at the request of shareholders holding at least 25% of the voting rights of the company. In approving a merger, the board of directors of both merging companies must determine that there is no reasonable concern that, as a result of the merger, the surviving company will not be able to satisfy its obligations to its creditors. Similarly, upon the request of a creditor of either party to the proposed merger, an Israeli court may prevent or delay the merger if it concludes that there exists a reasonable concern that, as a result of the merger, the surviving company will not be able to satisfy the obligations of the merging parties. A court may also issue other instructions for the protection of creditors’ rights in connection with a merger. Further, a merger may not be completed unless at least (i) 50 days have passed from the time that the requisite proposals for the approval of the merger were filed with the Israeli Registrar of Companies; and (ii) 30 days have passed since the merger was approved by the shareholders of each party to the merger. Under the Companies Law, subject to certain exceptions, an acquisition of shares in a public company must be made by means of a tender offer if, as a result of the acquisition, the purchaser would hold (i) 25% or more of the voting rights of the company if there is no other holder of 25% or more of the company’s voting rights; or (ii) more than 45% of the voting rights of the company if there is no other holder of more than 45% of the company’s voting rights. This requirement does not apply to certain events set forth in the Companies Law, including a purchase of shares by an offeree in a “private placement” that receives specific shareholder approval. The board of directors must either give the shareholders its opinion as to the advisability of the tender offer or explain why it is unable to do so. The board of directors must also disclose any personal interest of any of its members in the proposed acquisition. The tender offer may be consummated only if (i) at least 5% of the company’s voting rights will be acquired; and (ii) the majority of the offerees who responded to the offer accepted the offer, excluding offerees who are controlling shareholders of the offeror, offerees who hold 25% or more of the voting rights in the company or who have a personal interest in accepting the tender offer, or anyone on their behalf or on behalf of the offeror including the relatives of or corporations controlled by these persons. Under the Companies Law, a person may not acquire shares in a public company if, after the acquisition, he will hold more than 90% of the shares or more than 90% of any class of shares of that company, unless a tender offer is made to purchase all of the shares or all of the shares of the particular class, which we refer to as a full tender offer. The Companies Law also generally provides that as long as a shareholder in a public company holds more than 90% of the company’s shares or of a class of shares, that shareholder shall be precluded from purchasing any additional shares. In order that all of the shares that the purchaser offered to purchase be transferred to the purchaser by operation of law, one of the following must have occurred: (i) the shareholders who declined or who did not respond to the full tender offer hold less than 5% of the company’s outstanding share capital or of the relevant class of shares and the majority of offerees who do not have a personal interest in accepting the full tender offer accepted the offer, or (ii) the shareholders who declined or who did not respond to the full tender offer hold less than 2% of the company’s outstanding share capital or of the relevant class of shares. If the conditions set forth above are not met, the purchaser may not acquire shares of the company from shareholders who accepted the full tender offer to the extent that following such acquisition, the purchaser would own more than 90% of the company’s issued and outstanding share capital or more than 90% of the particular class of shares with respect to which the full tender offer was made. A shareholder that had his or her shares so transferred, whether he or she accepted the full tender offer or not, has the right, within six months from the date of acceptance of the full tender offer, to petition the court to determine that the full tender offer was for less than fair value and that the fair value should be paid as determined by the court. However, subject to certain conditions, the purchaser may provide in its offer that shareholders who accept the full tender offer will not be entitled to such rights. 10 ----- ###### PROSPECTUS SUPPLEMEN None NYM CLN PS PMT 1C",N/A,as_expected,2021,146
253_2,Preliminary Offerings 2021.md,552,DESCRIPTION OF ORDINARY SHARES,552.7,Board of Directors,552.7.1,,"Our board of directors consists of three classes of directors plus the chief executive officer, who is not part of any class. One of the classes is elected each year by the shareholders at our annual meeting for a term of approximately three years. Elected directors cannot be removed from office by the shareholders until the expiration of their term of office, unless they violate their duties of care or loyalty. In accordance with the Companies Law, we have elected to comply with SEC and NYSE requirements for independent directors on the Board and audit and compensation committees, in lieu of the Israeli requirements for statutory independent directors and audit committee and compensation committee composition. Following such election, we no longer designate any of our directors as statutory independent directors or designated independent directors under Israeli law. The holders of our ordinary shares representing a majority of the voting power represented at a shareholders’ meeting and voting at the meeting have the power to elect all of the directors up for election. In general, the board of directors formulates company policy and supervises the performance of the chief executive officer. Subject to the provisions of the Companies Law and the Articles, any Teva power that has not been conferred upon another body may be exercised by the board of directors. Neither our Memorandum or Articles, nor Israeli law, mandate retirement of directors at a certain age, or share ownership for a director’s qualification.",N/A,as_expected,2021,146
